Graco,24S115,,Graco Disk Spray Tip W6 - Hardened (24S115),simple,"<h2>Precision Performance for Texture Applications</h2><p>Ensure your texture spraying equipment operates at peak efficiency with the Graco Disk Spray Tip W6. Engineered for durability and consistent output, this hardened spray tip is a genuine OEM component designed to maintain the high standards of your Graco texture spray systems. Whether you are performing routine maintenance or replacing a worn-out part, this tip provides the reliability required for professional-grade results.</p><h2>Built for Durability</h2><p>Constructed from hardened materials, the W6 Disk Spray Tip is built to withstand the abrasive nature of texture coatings. By choosing an authentic Graco replacement part, you ensure seamless compatibility with your existing spray gun, reducing the risk of leaks, spitting, or uneven spray patterns. This precision-engineered component helps you maintain optimal flow control, allowing for a more uniform application and a superior finish on every project.</p><h2>Key Features</h2><ul><li><strong>Genuine Graco OEM Part:</strong> Guaranteed compatibility and performance for your specific Graco texture spray equipment.</li><li><strong>Hardened Construction:</strong> Enhanced durability designed to resist wear from abrasive texture materials, extending the service life of the tip.</li><li><strong>Consistent Spray Pattern:</strong> Engineered for precision, ensuring a reliable and even application for professional-quality finishes.</li><li><strong>Easy Installation:</strong> Designed for quick, hassle-free replacement, minimizing downtime on the job site.</li><li><strong>Optimized for Texture:</strong> Specifically calibrated for the demands of texture spraying applications, providing the control needed for complex surfaces.</li></ul><h2>Technical Specifications</h2><p>| Specification | Detail | | :--- | :--- | | Brand | Graco | | SKU | 24S115 | | Part Type | Disk Spray Tip | | Series | W6 | | Material | Hardened Steel | | Compatibility | Graco Texture Spray Systems |</p>",24S115 - Graco Disk Spray Tip W6 - Hardened. This is an original Graco part.,40.00,,https://drywalltoolbox.com/wp/wp-content/uploads/2026/04/Graco/Products/24s115.webp,Texture Tools > Graco > Spray Tips & Nozzles,"airless spray, Graco",574,1,0,visible,,,taxable,,1,,,0,0,,,,,1,,,,,,,,,,,Brand,Graco,1,1
Graco,24S116,,Graco Disk Spray Tip W8 - Hardened (24S116),simple,"<h2>Professional-Grade Precision: Graco W8 Hardened Disk Spray Tip</h2><p>Elevate your texture application projects with the Graco W8 Hardened Disk Spray Tip (24S116). Engineered for professionals who demand consistency and longevity, this hardened steel disk is specifically designed to withstand the abrasive nature of texture materials. Whether you are tackling fine finish texture applications or demanding industrial coating tasks, this component ensures a reliable, high-quality spray pattern that stands up to heavy-duty use.</p><h2>Built for Durability and Performance</h2><p>Unlike standard spray tips, the hardened construction of the 24S116 provides significantly extended service life, reducing downtime caused by frequent replacements. Its precision-engineered W8 WideTex design delivers a uniform, professional-grade finish, allowing you to maintain superior control over your spray application. This is an essential upgrade for contractors looking to optimize their equipment for long-term reliability and consistent output on every job site.</p><h2>Key Features</h2><ul><li><strong>Hardened Steel Construction:</strong> Engineered for maximum wear resistance, ensuring the tip maintains its integrity even when spraying abrasive texture materials.</li><li><strong>W8 WideTex Pattern:</strong> Delivers a consistent, professional-grade spray fan for uniform coverage and high-quality results.</li><li><strong>Extended Service Life:</strong> Designed to outperform standard disks, providing better value and fewer interruptions during large-scale projects.</li><li><strong>Professional Versatility:</strong> Ideal for a wide range of texture spraying applications, from fine interior finishes to industrial surface coatings.</li><li><strong>Genuine Graco Quality:</strong> Manufactured to strict tolerances to ensure seamless compatibility and peak performance with your existing Graco airless spray equipment.</li></ul><h2>Technical Specifications</h2><p>| Specification | Detail | | :--- | :--- | | Brand | Graco | | SKU | 24S116 | | Material | Hardened Steel | | Tip Type | Disk Spray Tip | | Size | W8 | | Category | Texture Tools &gt; Spray Tips & Nozzles | | Compatibility | Professional Airless Spray Systems |</p>",,40.00,,https://drywalltoolbox.com/wp/wp-content/uploads/2026/04/Graco/Products/24s116.webp,Texture Tools > Graco > Spray Tips & Nozzles,"airless spray, Graco",575,1,0,visible,,,taxable,,1,,,0,0,,,,,1,,,,,,,,,,,Brand,Graco,1,1
Graco,16X414,,Graco Endurance Chromex Piston Pump (16X414),simple,"<h2>Maximize Uptime with Genuine Graco Engineering</h2><p>Ensure your professional spraying equipment remains at peak performance with the Graco Endurance Chromex Piston Pump (16X414). Designed for contractors who demand reliability, this genuine OEM replacement pump is engineered to withstand the rigors of daily, heavy-duty use. By keeping a spare unit on hand, you effectively eliminate costly project delays and keep your operations running smoothly in the field.</p><h2>Unrivaled Durability and Performance</h2><p>This pump is built to outperform the competition, delivering twice the service life of leading alternative brands. At its core, the Endurance Chromex technology features a hardened stainless steel cylinder paired with a specialized Chromex rod, providing superior resistance to wear and abrasion. Equipped with high-performance V-Max Blue packings, this assembly ensures consistent pressure and reliable fluid delivery for every application.</p><h2>Key Features</h2><ul><li><strong>Extended Service Life:</strong> Engineered to last 2X longer than the next leading brand, reducing the frequency of replacements.</li><li><strong>Advanced Materials:</strong> Features a robust Chromex rod and a hardened stainless steel cylinder for maximum durability.</li><li><strong>Optimized Maintenance:</strong> The QuikPak Cartridge System allows for complete pump repacking in mere minutes, getting you back to work faster.</li><li><strong>Efficient Cleaning:</strong> Designed with a QuikAccess intake valve to simplify the cleaning process and prevent material buildup.</li><li><strong>Reliable Compatibility:</strong> Specifically engineered as a direct replacement for GMAX II 3900 Standard Series Lo-Boy sprayers (model year 2014 and newer).</li></ul><h2>Technical Specifications</h2><p>| Specification | Detail | | :--- | :--- | | Brand | Graco | | SKU | 16X414 | | Component Type | Endurance Chromex Piston Pump | | Compatibility | GMAX II 3900 Standard Series Lo-Boy (2014+) | | Cylinder Material | Hardened Stainless Steel | | Rod Material | Chromex | | Packing Type | V-Max Blue | | Maintenance System | QuikPak Cartridge System |</p>",Genuine Graco Endurance Pumps lead the industry in durability and ease of installation. Keep a spare on hand to minimize downtime in the field.,637.00,,https://drywalltoolbox.com/wp/wp-content/uploads/2026/04/Graco/Products/16x414.webp,Texture Tools > Graco > Pumps & Parts,Graco,576,1,0,visible,,,taxable,,1,,,0,0,,,,,1,,,,,,,,,,,Brand,Graco,1,1
Graco,16Y598,,Graco Endurance Chromex Piston Pump (16Y598),simple,"<h2>Maximize Uptime with the Graco Endurance Chromex Piston Pump</h2><p>Keep your professional spray equipment performing at its peak with the Graco Endurance Chromex Piston Pump (16Y598). Engineered for the rigorous demands of high-volume coating applications, this genuine Graco replacement pump is the industry standard for reliability and longevity. By maintaining a spare on-site, you can effectively eliminate costly downtime and ensure your projects stay on schedule, regardless of the job site challenges.</p><h2>Engineered for Professional Performance</h2><p>Designed specifically for compatibility with select Graco Ultra Max II and GMAX II sprayers, this pump features the advanced Endurance Chromex technology, which is proven to last twice as long as competing alternatives. The integrated QuickChange design allows for rapid, tool-free pump swaps directly in the field, while the QuikPak Cartridge System simplifies maintenance, enabling you to repack the pump in mere minutes. With the addition of the QuikAccess intake foot valve, cleaning is faster and more efficient than ever, allowing you to focus on the finish rather than the equipment.</p><h2>Key Features</h2><ul><li><strong>Extended Service Life:</strong> Built with Endurance Chromex technology to provide 2X the durability of standard aftermarket pumps.</li><li><strong>QuickChange Design:</strong> Enables seamless, on-the-job pump replacement without the need for specialized tools.</li><li><strong>QuikPak Cartridge System:</strong> Streamlines the maintenance process, allowing for rapid repacking to keep your sprayer operational.</li><li><strong>Efficient Cleaning:</strong> Features a QuikAccess intake foot valve for quick and easy debris removal and maintenance.</li><li><strong>Genuine Graco Quality:</strong> Ensures perfect compatibility, consistent pressure generation, and reliable fluid transfer for professional-grade results.</li></ul><h2>Technical Specifications</h2><p>| Specification | Detail | | :--- | :--- | | Brand | Graco | | SKU | 16Y598 | | Compatibility | Ultra Max II 695/795 (2019+), GMAX II 3900 (2019+) | | Pump Type | Endurance Chromex Piston Pump | | Maintenance System | QuikPak Cartridge System | | Fluid Inlet Thread | 1 5/16"" Male UN |</p>",Graco Endurance Chromex Piston Pump - 16Y598,,,https://drywalltoolbox.com/wp/wp-content/uploads/2026/04/Graco/Products/16y598.webp,Texture Tools > Graco > Repair Kits & Parts,,577,1,0,visible,,,taxable,,1,,,0,0,,,,,1,,,,,,,,,,,,,,
Graco,17H828,,Graco Endurance Chromex Piston Pump (17H828),simple,"<h2>Maximize Uptime with the Graco Endurance Chromex Piston Pump</h2><p>Engineered for the rigorous demands of professional contracting, the Graco Endurance Chromex Piston Pump (17H828) is the ultimate solution for maintaining peak performance in your TexSpray Mark IV Standard Series sprayers. Designed specifically for models manufactured in 2019 and later, this genuine Graco replacement part ensures your equipment continues to deliver the consistent, high-pressure output required for large-scale commercial and industrial coating projects.</p><h2>Unmatched Durability and Efficiency</h2><p>Don't let equipment failure stall your progress. This pump features Graco’s industry-leading Endurance technology, proven to last twice as long as competing alternatives. With a robust Chromex-coated rod and a hardened stainless steel cylinder, it is built to withstand abrasive materials and heavy daily use. The integration of Long Life V-Max Blue packings further extends service intervals, while the innovative QuikPak Cartridge System allows you to perform a complete pump repack in mere minutes, significantly reducing your time spent on maintenance and maximizing your time on the job site.</p><h2>Key Features</h2><ul><li><strong>Extended Service Life:</strong> Engineered with premium materials to provide double the longevity of standard aftermarket pumps.</li><li><strong>Rapid Maintenance:</strong> The QuikPak Cartridge System enables fast, tool-free repairs, getting you back to spraying in minutes.</li><li><strong>Superior Construction:</strong> Features a durable Chromex rod and hardened stainless steel cylinder for maximum resistance to wear.</li><li><strong>Optimized Performance:</strong> Equipped with Long Life V-Max Blue packings for reliable, high-pressure sealing under demanding conditions.</li><li><strong>Streamlined Cleaning:</strong> The QuikAccess intake valve design simplifies the cleaning process, ensuring your sprayer remains in top condition between uses.</li></ul><h2>Technical Specifications</h2><p>| Specification | Detail | | :--- | :--- | | Brand | Graco | | SKU | 17H828 | | Compatibility | TexSpray Mark IV Standard Series (2019 & Newer) | | Pump Technology | Endurance Chromex | | Packing Material | V-Max Blue + Leather | | Ball Components | Ceramic | | Maintenance System | QuikPak Cartridge System |</p>",Graco Endurance Chromex Piston Pump - 17H828,,,https://drywalltoolbox.com/wp/wp-content/uploads/2026/04/Graco/Products/17h828.webp,Texture Tools > Graco > Repair Kits & Parts,,578,1,0,visible,,,taxable,,1,,,0,0,,,,,1,,,,,,,,,,,,,,
Graco,287328,,Graco External Compressor Connection Kit (287328),simple,"<h2>Elevate Your Texture Finishing with Superior Atomization</h2><p>The Graco External Compressor Connection Kit (287328) is an essential performance upgrade for professionals operating the RTX 1500 texture sprayer. By integrating an external air source, this kit significantly enhances the atomization capabilities of your spray gun, allowing for a more refined, consistent, and professional-grade finish on every project. Whether you are tackling complex wall textures or large-scale ceiling applications, this accessory provides the extra pneumatic power required to achieve superior results.</p><h2>Engineered for Professional Performance</h2><p>Designed to meet the rigorous demands of the job site, this genuine Graco component ensures seamless compatibility and reliable operation with your existing RTX 1500 system. By bypassing the limitations of the internal air supply, you gain the ability to utilize a more robust, user-supplied compressor, effectively increasing your spray gun's output energy. This is the ideal solution for contractors who require higher precision and better control when applying diverse materials, from standard drywall mud to specialized acoustic coatings.</p><h2>Key Features</h2><ul><li><strong>Enhanced Atomization:</strong> Enables the use of an external air supply to achieve a finer, more uniform spray pattern at the gun.</li><li><strong>System Compatibility:</strong> Specifically engineered for seamless integration with the Graco RTX 1500 texture sprayer.</li><li><strong>Professional Grade:</strong> Built to Graco’s exacting standards for durability and long-term reliability in demanding work environments.</li><li><strong>Increased Versatility:</strong> Provides the flexibility to adjust air output to match the specific requirements of your texture material and surface finish.</li><li><strong>Easy Installation:</strong> Designed for straightforward setup, allowing you to quickly upgrade your equipment and get back to work.</li></ul><h2>Technical Specifications</h2><p>| Specification | Detail | | :--- | :--- | | Brand | Graco | | SKU | 287328 | | Compatibility | Graco RTX 1500 Texture Sprayer | | Required Air Supply | User-supplied compressor | | Minimum Air Output | 10 cfm @ 100 psi | | Product Type | Auxiliary Air Kit |</p>",Graco RTX Auxiliary Air Kit 287328 for RTX 1500 allows use of external air supply for greater atomization at spray gun. (Requires user-supplied compressor with minimum output 10 cfm @ 100 psi),380.00,,https://drywalltoolbox.com/wp/wp-content/uploads/2026/04/Graco/Products/287328.webp,Texture Tools > Graco > Texture Sprayers,Graco,579,1,0,visible,,,taxable,,1,,,0,0,,,,,1,,,,,,,,,,,Brand,Graco,1,1
Graco,287227,,Graco Fine Finish Nozzle Kit for TexSpray Guns (287227),simple,"<h2>Achieve Professional-Grade Texture Precision</h2><p>Elevate your finishing capabilities with the Graco Fine Finish Nozzle Kit (287227), an essential OEM accessory engineered for professionals who demand superior control and consistency. Designed specifically for Graco TexSpray guns, this comprehensive kit allows you to transition from standard texture applications to refined, high-detail finishes with ease. Whether you are tackling orange peel, fine splatter, or intricate interior coating work, this kit provides the versatility required to achieve a flawless, uniform appearance on every project.</p><h2>Versatile Pattern Control</h2><p>This kit is built for adaptability, featuring a range of atomizing discs that allow you to fine-tune your spray pattern to match the specific material and finish requirements of your job. By selecting the appropriate disc size, you can effectively control particle size and fan width, ensuring optimal coverage and professional results. The smaller the disc, the wider the fan and the finer the finish, giving you the precision needed for high-end architectural detailing. Always ensure the kit is used in conjunction with a compatible fluid nozzle for peak performance.</p><h2>Key Features</h2><ul><li><strong>Comprehensive Kit:</strong> Includes four distinct atomizing spray discs (3.2 mm, 6.4 mm, 8.0 mm, and 9.5 mm) to accommodate a wide variety of texture finishes.</li><li><strong>OEM Quality:</strong> Genuine Graco replacement part ensures perfect compatibility, durability, and reliable performance with your existing TexSpray equipment.</li><li><strong>Precision Engineering:</strong> Designed to produce a consistent, flat spray pattern, ideal for detailed coating work where accuracy is paramount.</li><li><strong>Complete Installation:</strong> Comes with all necessary components, including the nozzle adapter and retaining nut, for a quick and secure setup.</li><li><strong>Enhanced Versatility:</strong> Allows for seamless switching between different texture styles, making it an indispensable tool for professional contractors.</li></ul><h2>Technical Specifications</h2><p>| Specification | Detail | | :--- | :--- | | Brand | Graco | | SKU | 287227 | | Kit Contents | 3.2mm, 6.4mm, 8.0mm, 9.5mm Discs, Adapter, Retaining Nut | | Compatibility | Select TexSpray Guns (e.g., 235490, 24R054, 248091) | | Application | Fine finish texture (orange peel, fine splatter) | | Part Type | OEM Accessory |</p>",Graco Fine Finish Nozzle Kit for TexSpray Guns,,,https://drywalltoolbox.com/wp/wp-content/uploads/2026/04/Graco/Products/287227.webp,Texture Tools > Graco > Repair Kits & Parts,,580,1,0,visible,,,taxable,,1,,,0,0,,,,,1,,,,,,,,,,,,,,
Graco,246468,,Graco Flex Plus Airless Spray Gun RAC X 517 Tip (246468),simple,"<h2>Professional-Grade Performance for Heavy-Duty Applications</h2><p>The Graco Flex Plus Airless Spray Gun (246468) is engineered for contractors who demand reliability and precision when handling high-viscosity materials. Whether you are applying heavy coatings or spraying joint compounds, this professional-grade tool provides the consistent flow and durability required for demanding job sites. Designed with an emphasis on operator comfort and maintenance efficiency, it is the go-to solution for high-output texture and coating projects.</p><h2>Engineered for Efficiency and Comfort</h2><p>This spray gun features an ergonomic handle specifically shaped to minimize operator fatigue during extended spraying sessions, ensuring you maintain control and comfort throughout the workday. The internal architecture includes a large fluid path that significantly reduces the risk of clogging, even when working with thicker materials. With its patented needle design and a no-adjustment needle system, the Flex Plus allows for rapid, hassle-free repairs, keeping your downtime to an absolute minimum.</p><h2>Key Features</h2><ul><li><strong>Heavy-Duty Versatility:</strong> Optimized for high-performance spraying of joint compounds and heavy-duty coatings.</li><li><strong>Ergonomic Design:</strong> Contoured handle reduces hand strain and increases comfort for all-day professional use.</li><li><strong>Anti-Clog Fluid Path:</strong> Large-diameter internal path ensures smooth material delivery and minimizes blockages.</li><li><strong>Simplified Maintenance:</strong> Features a no-adjustment needle system for quick, straightforward field repairs.</li><li><strong>Patented Needle Technology:</strong> Advanced design increases the overall lifespan of the gun, providing long-term value.</li><li><strong>RAC X System:</strong> Includes the industry-standard RAC X 517 SwitchTip and Guard for precise pattern control and easy tip changes.</li></ul><h2>Technical Specifications</h2><p>| Specification | Detail | | :--- | :--- | | Brand | Graco | | SKU | 246468 | | Product Type | Airless Spray Gun | | Trigger Type | 2-Finger | | Included Tip | RAC X 517 SwitchTip | | Included Guard | RAC X Guard | | Primary Application | Heavy coatings and joint compounds |</p>",Graco Flex Plus Airless Spray Gun RAC X 517 Tip,,,https://drywalltoolbox.com/wp/wp-content/uploads/2026/04/Graco/Products/246468.webp,Texture Tools > Graco > Repair Kits & Parts,,581,1,0,visible,,,taxable,,1,,,0,0,,,,,1,,,,,,,,,,,,,,
Graco,24B327,,"Graco Freeflow Inline Gun Kit with 4, 6, 8 10 MM Nozzels, 18 30 Mesh Filter, RAC 671 Tip, and RAC X Gaurd (24B327)",simple,"<h2>Precision Performance for Texture Applications</h2><p>Maximize the versatility and efficiency of your Graco HTX 2030 texture sprayer with the Graco Freeflow Inline Gun Kit (24B327). This comprehensive applicator kit is engineered specifically for professionals who demand consistent, high-quality results when applying heavy-bodied materials, including textured acrylics, elastomerics, EIFS, synthetic stucco, and various decorative finishes like knockdown or splatter.</p><h2>Engineered for Versatility</h2><p>This kit provides the essential components required to adapt your equipment to a wide range of surface textures and material viscosities. By including a variety of nozzle sizes and filtration options, the Freeflow Inline Gun allows for rapid on-site adjustments, ensuring you maintain optimal flow rates and pattern control throughout your project. The ergonomic inline design reduces operator fatigue during extended use, while the robust construction ensures the durability required for demanding job site environments.</p><h2>Key Features</h2><ul><li><strong>Comprehensive Nozzle Selection:</strong> Includes 4mm, 6mm, 8mm, and 10mm nozzles to accommodate diverse material thicknesses and desired texture patterns.</li><li><strong>Optimized Filtration:</strong> Comes with 18 and 30 mesh filters to prevent clogs and maintain a smooth, uninterrupted application process.</li><li><strong>Advanced Spray Control:</strong> Features the high-performance RAC X 671 tip and RAC X guard, providing superior pattern definition and easy, tool-free clearing of obstructions.</li><li><strong>Professional-Grade Durability:</strong> Genuine Graco OEM components designed for long-term reliability and seamless integration with your existing HTX 2030 system.</li><li><strong>Application Flexibility:</strong> Ideal for a wide array of finishes, from fine orange peel and splatter to heavy-duty acoustic and stucco coatings.</li></ul><h2>Technical Specifications</h2><p>| Specification | Detail | | :--- | :--- | | Brand | Graco | | SKU | 24B327 | | Compatibility | HTX 2030 Texture Sprayer | | Nozzle Sizes Included | 4mm, 6mm, 8mm, 10mm | | Filter Mesh Sizes | 18 Mesh, 30 Mesh | | Tip Included | RAC X 671 | | Guard Included | RAC X Guard | | Material Compatibility | Water-based materials only | | Max Working Pressure | 1000 psi (6.9 MPa, 69 bar) |</p>","Graco Freeflow Inline Gun Kit with 4, 6, 8 10 MM Nozzels, 18 30 Mesh Filter, RAC 671 Tip, and RAC X Gaurd (Graco 24B327)",,,https://drywalltoolbox.com/wp/wp-content/uploads/2026/04/Graco/Products/24b327.webp,Texture Tools > Graco > Repair Kits & Parts,,582,1,0,visible,,,taxable,,1,,,0,0,,,,,1,,,,,,,,,,,,,,
