Graco,15C886,,Graco 8MM Spray Texture Nozzle for RTX 1500 (15C886),simple,"<h2>Achieve Professional Texture Finishes with Precision</h2><p>Ensure your Graco RTX 1500 texture sprayer performs at its peak with the genuine Graco 8mm Spray Texture Nozzle. Engineered for contractors who demand consistency and reliability, this nozzle is an essential component for achieving high-quality splatter and small-to-medium knockdown finishes. By utilizing authentic Graco replacement parts, you maintain the integrity of your equipment's spray pattern, ensuring uniform coverage and professional-grade results on every project.</p><h2>Optimized for Versatility and Performance</h2><p>This 8mm nozzle is specifically calibrated to handle a variety of interior and exterior texture applications. Whether you are working on decorative coatings or standard wall and ceiling finishes, the precision-engineered orifice provides the necessary flow control to deliver the exact texture profile your project requires. Its durable construction is designed to withstand the rigors of daily job-site use, minimizing downtime and keeping your productivity high.</p><h2>Key Features</h2><ul><li><strong>Precision Engineering:</strong> Designed for consistent, reliable spray patterns, ensuring a uniform finish across all surfaces.</li><li><strong>Application Versatility:</strong> Ideal for splatter and small-to-medium knockdown texture applications.</li><li><strong>Genuine Graco Quality:</strong> Manufactured to exact OEM standards for a perfect fit and seamless integration with your RTX 1500 sprayer.</li><li><strong>Durable Construction:</strong> Built to endure the demanding conditions of professional construction environments.</li><li><strong>Easy Identification:</strong> Part of the Graco color-coded nozzle system, allowing for quick selection of the correct tip size for your specific finish requirements.</li></ul><h2>Technical Specifications</h2><p>| Specification | Detail | | :--- | :--- | | Brand | Graco | | SKU | 15C886 | | Nozzle Size | 8mm | | Compatible Equipment | RTX 1500, GTX 2000 Series, RTX Heavy-Duty Texture Guns | | Application Type | Splatter, Small-to-Medium Knockdown | | Part Type | Texture Gun Nozzle Assembly |</p>",Graco 8MM Spray Texture Nozzle for RTX 1500,,,https://drywalltoolbox.com/wp/wp-content/uploads/2026/04/Graco/Products/15c886.webp,Texture Tools > Graco > Repair Kits & Parts,,555,1,0,visible,,,taxable,,1,,,0,0,,,,,1,,,,,,,,,,,,,,
Graco,24U172,,"Graco 9"" Jet Roller System with Fixed Extension, CleanShot Valve, & In-Line Valve (24U172)",simple,"<h2>Revolutionize Your Workflow with the Graco JetRoller System</h2><p>Maximize your productivity on the job site with the Graco 9"" JetRoller System (24U172). Engineered for professionals who demand speed and precision, this innovative 2-in-1 tool seamlessly integrates airless spraying with traditional back-rolling. By combining these two essential steps into a single, fluid motion, you can complete large-scale projects up to four times faster than conventional methods, all while eliminating the fatigue associated with constantly climbing ladders or managing messy paint trays and grids.</p><h2>Superior Finish on Challenging Surfaces</h2><p>Designed to excel where standard rollers struggle, the JetRoller is the ultimate solution for rough, porous, or textured surfaces. The integrated Contractor In-Line Valve ensures a consistent, controlled flow of paint directly to the roller, providing a professional-grade finish with minimal effort. Its low-overspray design significantly reduces prep and cleanup time, allowing you to maintain a cleaner workspace and focus on delivering high-quality results for your clients.</p><h2>Key Features</h2><ul><li><strong>2-in-1 Efficiency:</strong> Combines airless spraying and back-rolling into one pass, drastically reducing labor time and physical strain.</li><li><strong>CleanShot Shut-Off Valve:</strong> Precision-engineered to eliminate annoying spits and drips, ensuring a flawless application from start to finish.</li><li><strong>Versatile Modular Design:</strong> Easily detaches to function as a standalone spray extension or a manual hand roller, providing maximum flexibility for diverse project requirements.</li><li><strong>Professional Control:</strong> Includes the Contractor In-Line Valve and RAC X LTX 721 SwitchTip for superior flow management and spray pattern accuracy.</li><li><strong>Universal Compatibility:</strong> Designed to work with industry-standard 9-inch roller covers (sold separately) and fits most existing airless sprayers, making it a seamless addition to your current equipment arsenal.</li></ul><h2>Technical Specifications</h2><p>| Specification | Detail | | :--- | :--- | | Brand | Graco | | SKU | 24U172 | | System Type | JetRoller Pressure Rolling System | | Roller Size | 9 inches (23 cm) | | Max Working Pressure | 3596 psi (24.8 MPa) | | Included Components | Contractor In-Line Valve, CleanShot Shut-Off Valve, 20"" Heavy-Duty Extension, 12"" Roller Handle Extension, 9"" Roller Handle Assembly, RAC X LTX 721 SwitchTip, RAC X HandTite Guard | | Compatibility | Standard 9"" roller covers (not included) | | Application | Rough or porous surfaces, spray/back-roll projects |</p>","Complete with the Contractor In-Line Valve, the JetRoller System combines rolling and spraying into one action, saving time and labor on spray/back roll projects. Ideal for rough or porous surfaces, the JetRoller minimizes overspray and delivers a consistent finish. Roller cover not included. Uses standard 9-inch roller covers.",624.00,,https://drywalltoolbox.com/wp/wp-content/uploads/2026/04/Graco/Products/24u172.webp,Texture Tools > Graco > Applicators & Rollers,"9"", Graco",556,1,0,visible,,,taxable,,1,,,0,0,,,,,1,,,,,,,,,,,Brand,Graco,1,1
Graco,24Z003,,Graco Adapter Swivel (3/4 NH X 1 NPSH) - 247003 (24Z003),simple,"<h2>Seamless Connectivity for Your Spray Equipment</h2><p>Ensure your professional spraying system operates at peak efficiency with the Graco 24Z003 Swivel Adapter. Engineered to bridge the gap between different hose thread standards, this genuine Graco component provides a reliable, leak-resistant connection essential for high-performance texture and spray applications. By integrating this swivel adapter into your setup, you eliminate the frustration of hose binding and twisting, allowing for greater maneuverability and extended hose life during demanding jobs.</p><h2>Precision Engineering for Professional Results</h2><p>Designed specifically for compatibility with Graco texture sprayers and related equipment, this adapter features a robust construction that meets the rigorous demands of the job site. The swivel functionality is critical for operators who require fluid movement while spraying, reducing strain on both the hose and the user. As an authentic Graco OEM part, it guarantees the exact fit and material quality required to maintain your equipment's warranty and operational integrity.</p><h2>Key Features</h2><ul><li><strong>Genuine Graco Quality:</strong> Manufactured to strict OEM standards to ensure perfect compatibility and long-term durability in professional environments.</li><li><strong>Swivel Action:</strong> Integrated swivel design prevents hose kinking and twisting, significantly improving ease of use and maneuverability during spray applications.</li><li><strong>Versatile Threading:</strong> Specifically configured with 3/4"" NH and 1"" NPSH connections to bridge common equipment and hose thread types.</li><li><strong>Optimized Performance:</strong> Facilitates smooth material flow, essential for maintaining consistent pressure and output in texture and coating applications.</li><li><strong>Easy Installation:</strong> Designed for quick and secure attachment, minimizing downtime when configuring or maintaining your spray system.</li></ul><h2>Technical Specifications</h2><p>| Specification | Detail | | :--- | :--- | | Brand | Graco | | SKU | 24Z003 | | Connection Type | Swivel Adapter | | Thread Size A | 3/4"" NH | | Thread Size B | 1"" NPSH | | Part Type | Genuine OEM Replacement | | Category | Hoses & Fittings |</p>",Graco part 24Z003 - ADAPTER SWIVEL (3/4 NH X 1 NPSH) - Graco Original Part - This is a Graco genuine part.,53.50,,https://drywalltoolbox.com/wp/wp-content/uploads/2026/04/Graco/Products/24z003.webp,Texture Tools > Graco > Hoses & Fittings,Graco,557,1,0,visible,,,taxable,,1,,,0,0,,,,,1,,,,,,,,,,,Brand,Graco,1,1
Graco,244052,,Graco Air Atomizer Kit w/ Air Hose (244052),simple,"<h2>Achieve Professional Texture Finishes with Precision</h2><p>The Graco Air Atomizer Kit (244052) is an essential upgrade for professionals looking to expand the capabilities of their texture spraying equipment. Designed to integrate seamlessly with your existing Graco heavy-duty texture guns, this kit provides the necessary components to connect an external air compressor, enabling the precise atomization required for high-quality decorative finishes. Whether you are applying orange peel, splatter, or knockdown textures to walls and ceilings, this genuine Graco accessory ensures the consistent airflow and control needed for professional-grade results.</p><h2>Engineered for Reliability and Performance</h2><p>Built to withstand the rigorous demands of construction and finishing environments, this kit includes a high-quality air hose and the necessary atomizer components to maintain optimal equipment performance. By utilizing genuine Graco parts, you ensure perfect compatibility with your sprayer, reducing downtime and maintaining the integrity of your application process. This kit is a must-have for contractors who demand efficiency, reliability, and superior finish quality on every job site.</p><h2>Key Features</h2><ul><li><strong>Genuine Graco Quality:</strong> Manufactured to strict OEM standards to ensure perfect fit, durability, and consistent performance with your Graco texture sprayer.</li><li><strong>Versatile Texture Application:</strong> Enables the creation of various decorative finishes, including orange peel, splatter, and knockdown, by providing controlled air atomization.</li><li><strong>Complete Kit:</strong> Includes the essential air atomizer components and a durable air hose, providing a ready-to-use solution for connecting your air compressor.</li><li><strong>Enhanced Control:</strong> Allows for precise adjustment of air supply, giving you the flexibility to achieve the exact texture pattern required for your project.</li><li><strong>Broad Compatibility:</strong> Specifically designed for use with Graco Heavy-Duty Texture Guns, Flex Plus Airless Spray Guns, and compatible sprayers like the Mark IV, Mark V, and GMax 5900HD.</li></ul><h2>Technical Specifications</h2><p>| Specification | Detail | | :--- | :--- | | Brand | Graco | | SKU | 244052 | | Kit Type | Air Atomizer Kit with Air Hose | | Compatibility | Mark IV, Mark V, GMax 5900HD Texture Sprayers | | Application | Decorative texture finishes (orange peel, splatter, knockdown) | | Included Components | Air Atomizer, Air Hose | | Category | Texture Sprayer Accessories |</p>",Graco Kit Atomizer with Hose 244052,500.57,,https://drywalltoolbox.com/wp/wp-content/uploads/2026/04/Graco/Products/244052.webp,Texture Tools > Graco > Texture Sprayers,"Graco, spray hose",558,1,0,visible,,,taxable,,1,,,0,0,,,,,1,,,,,,,,,,,Brand,Graco,1,1
Graco,287229,,Graco Air Needle Repair Kit for 248091 Gun (287229),simple,"<h2>Restore Peak Performance to Your Texture Sprayer</h2><p>Maintain the precision and reliability of your Graco equipment with the genuine Graco Air Needle Repair Kit (287229). Designed specifically for the 248091 texture spray gun, this essential maintenance kit provides the high-quality components necessary to resolve air leaks and restore proper triggering functionality. By replacing worn internal air valve components with original OEM parts, you ensure your sprayer continues to deliver the consistent, professional-grade results required for demanding texture application projects.</p><h2>Why Choose Genuine Graco Parts?</h2><p>Using authentic Graco replacement parts is the most effective way to protect your investment and minimize costly downtime on the job site. This repair kit is engineered to meet the exact specifications of your hardware, ensuring a seamless fit and reliable operation. Whether you are a professional contractor or a dedicated tradesperson, this kit helps you maintain the efficiency and longevity of your TexSpray system, allowing you to focus on achieving a flawless finish without equipment-related interruptions.</p><h2>Key Features</h2><ul><li><strong>Genuine OEM Quality:</strong> Manufactured by Graco to ensure perfect compatibility, durability, and performance standards for your specific spray gun model.</li><li><strong>Restores Air Control:</strong> Effectively addresses air valve issues, ensuring precise airflow and consistent spray patterns for professional-quality texture application.</li><li><strong>Extends Equipment Life:</strong> Regular maintenance with factory-spec components prevents further wear and tear, helping your spray gun last longer under rigorous daily use.</li><li><strong>Easy Maintenance:</strong> Designed for straightforward installation, allowing you to perform necessary repairs quickly and get back to work with minimal delay.</li><li><strong>Optimized for Texture Systems:</strong> Specifically tailored for the 248091 gun used in various Graco TexSpray systems, ensuring reliable performance with water-based materials.</li></ul><h2>Technical Specifications</h2><p>| Specification | Detail | | :--- | :--- | | Brand | Graco | | SKU | 287229 | | Compatible Gun Model | 248091 | | Part Type | Air Needle Repair Kit | | Application | Texture Spraying Equipment | | Material Compatibility | Water-Based Materials |</p>",Graco Air Needle Repair Kit for 248091 Gun,,,https://drywalltoolbox.com/wp/wp-content/uploads/2026/04/Graco/Products/287229.webp,Texture Tools > Graco > Repair Kits & Parts,,559,1,0,visible,,,taxable,,1,,,0,0,,,,,1,,,,,,,,,,,,,,
Graco,119184,,"Graco Bearing Sleeve, 4MM Shaft (119184)",simple,"<h2>Restore Precision Performance</h2><p>Ensure your Graco equipment continues to operate at peak efficiency with the genuine Graco 4mm Bearing Sleeve (Part #119184). Engineered to exact manufacturer specifications, this critical component is designed to minimize friction and reduce wear within your sprayer's internal assembly. By providing a stable, low-friction interface for the 4mm shaft, this sleeve helps maintain precise alignment and effectively dampens vibration during high-demand operation.</p><h2>Built for Reliability</h2><p>As a vital sacrificial component, this bearing sleeve is crafted to withstand the rigors of professional-grade texture and paint spraying applications. Replacing a worn or damaged sleeve is essential for preventing secondary damage to more expensive internal parts, ensuring your equipment remains reliable on the job site. Trust in authentic Graco engineering to deliver the durability and seamless fit required to keep your machinery running smoothly.</p><h2>Key Features</h2><ul><li><strong>Genuine OEM Quality:</strong> Manufactured by Graco to ensure perfect compatibility and performance with your existing equipment.</li><li><strong>Precision Engineering:</strong> Specifically designed for 4mm diameter shafts to provide an exact, secure fit.</li><li><strong>Friction Reduction:</strong> Minimizes internal drag and wear, extending the service life of your sprayer's rotating or sliding components.</li><li><strong>Vibration Dampening:</strong> Helps stabilize the shaft assembly, contributing to consistent spray patterns and reduced mechanical stress.</li><li><strong>Essential Maintenance:</strong> An ideal replacement part to restore factory-level performance and prevent costly downtime during critical projects.</li></ul><h2>Technical Specifications</h2><p>| Specification | Detail | | :--- | :--- | | Brand | Graco | | Part Number | 119184 | | Component Type | Bearing Sleeve | | Shaft Compatibility | 4mm Diameter | | Application | Paint and Texture Sprayer Repair | | Country of Origin | Germany |</p>","Graco Bearing Sleeve, 4MM Shaft - 119184",,,https://drywalltoolbox.com/wp/wp-content/uploads/2026/04/Graco/Products/119184.webp,Texture Tools > Graco > Repair Kits & Parts,,560,1,0,visible,,,taxable,,1,,,0,0,,,,,1,,,,,,,,,,,,,,
Graco,118845,,Graco Belt for RTX 1500 (118845),simple,"<h2>Restore Peak Performance to Your Graco RTX 1500</h2><p>Keep your professional texture spraying equipment running at its best with this genuine Graco replacement belt. Designed specifically for the RTX 1500, this high-quality drive belt ensures consistent power transmission from your motor to the pump assembly, maintaining the reliable performance you need to tackle demanding texture applications on the job site.</p><h2>Precision Engineering for Reliable Operation</h2><p>When your sprayer’s drive system begins to show signs of wear, replacing the belt is a critical maintenance step to prevent unexpected downtime. This replacement component is built to meet Graco’s rigorous standards for durability and fit, ensuring that your machine maintains proper tension and smooth operation. Whether you are performing routine preventative maintenance or addressing a worn-out part, this belt provides the exact specifications required to get your RTX 1500 back in action quickly and efficiently.</p><h2>Key Features</h2><ul><li><strong>Genuine Graco Quality:</strong> Manufactured to exact OEM specifications for a perfect fit and reliable long-term performance.</li><li><strong>Optimized for RTX 1500:</strong> Specifically engineered to integrate seamlessly with the drive system of the Graco RTX 1500 texture sprayer.</li><li><strong>Essential Maintenance:</strong> A critical component for restoring proper motor-to-pump power transfer and ensuring consistent texture output.</li><li><strong>Durable Construction:</strong> Built to withstand the rigors of daily professional use in demanding construction environments.</li><li><strong>Easy Installation:</strong> Designed for straightforward replacement, allowing you to minimize downtime and return to your projects faster.</li></ul><h2>Technical Specifications</h2><p>| Specification | Detail | | :--- | :--- | | Brand | Graco | | SKU | 118845 | | Compatibility | Graco RTX 1500 Texture Sprayer | | Part Type | Replacement Drive Belt | | Category | Texture Sprayer Parts |</p>",Replacement belt for the Graco RTX 1500.,78.06,,https://drywalltoolbox.com/wp/wp-content/uploads/2026/04/Graco/Products/118845.webp,Texture Tools > Graco > Texture Sprayers,Graco,561,1,0,visible,,,taxable,,1,,,0,0,,,,,1,,,,,,,,,,,Brand,Graco,1,1
Graco,17J675,,"Graco Belt, Synchronous (17J675)",simple,"<h2>Restore Peak Performance with the Genuine Graco Synchronous Belt</h2><p>Ensure your professional spray equipment operates with factory-grade precision by replacing worn or damaged drive components with the authentic Graco 17J675 Synchronous Belt. Engineered to meet the exact specifications of your Graco machinery, this high-quality replacement part is essential for maintaining consistent power transmission and preventing slippage during demanding applications.</p><h2>Precision Engineering for Reliable Operation</h2><p>As a critical component of your equipment's drive system, this synchronous belt features a specialized tooth profile designed to interlock perfectly with your pulleys. By maintaining a constant, synchronized speed ratio, it eliminates the inefficiencies of friction-based drives, resulting in smoother operation, reduced noise, and extended service life for your pump and motor assemblies. Whether you are performing routine preventative maintenance or executing an urgent repair, choosing this genuine OEM part guarantees the compatibility and durability required to keep your projects on schedule and your equipment running at its peak.</p><h2>Key Features</h2><ul><li><strong>Genuine OEM Quality:</strong> Manufactured by Graco to ensure an exact fit, optimal tension, and seamless integration with your existing hardware.</li><li><strong>Synchronous Power Transfer:</strong> The precision-molded tooth design ensures a non-slip, constant transmission ratio for consistent performance under load.</li><li><strong>Enhanced Durability:</strong> Constructed from high-strength, wear-resistant materials designed to withstand the rigors of continuous industrial and construction-site use.</li><li><strong>Maintenance Efficiency:</strong> Designed for straightforward installation, helping you minimize equipment downtime and restore productivity quickly.</li><li><strong>Reliable Compatibility:</strong> Specifically engineered for use across a range of Graco fluid handling systems and professional airless sprayers.</li></ul><h2>Technical Specifications</h2><p>| Specification | Detail | | :--- | :--- | | Brand | Graco | | SKU | 17J675 | | Part Type | Synchronous Belt | | Compatibility | Select Graco Fluid Handling & Spraying Systems | | Condition | New OEM Part |</p>","Graco Belt, Synchronous - 17J675",,,https://drywalltoolbox.com/wp/wp-content/uploads/2026/04/Graco/Products/17j675.webp,Texture Tools > Graco > Repair Kits & Parts,,562,1,0,visible,,,taxable,,1,,,0,0,,,,,1,,,,,,,,,,,,,,
Graco,17J420,,"Graco Blue Hose Kit 1"" x 25' for RTX 1500/2000pi/5000pi (17J420)",simple,"<h2>Optimize Your Texture Spraying Performance</h2><p>Maintain peak efficiency on the job site with the Graco Blue Hose Kit (17J420). Engineered specifically for demanding texture application environments, this professional-grade, twin-line hose assembly ensures reliable delivery of both air and material. Whether you are tackling large-scale commercial projects or intricate residential finishes, this genuine Graco replacement part provides the durability and consistent flow required to achieve professional-grade results every time.</p><h2>Engineered for Reliability and Visibility</h2><p>Designed to withstand the rigors of daily professional use, the 17J420 hose kit features a robust, translucent blue construction. This design choice is not just aesthetic; it allows for real-time visual monitoring of material flow, helping you identify potential clogs or flow issues before they impact your finish. The bonded twin-line configuration streamlines your setup, reducing tangles and improving maneuverability while you work. By choosing genuine Graco components, you protect your equipment investment and ensure seamless compatibility with your existing RTX and GTX systems.</p><h2>Key Features</h2><ul><li><strong>Genuine Graco Quality:</strong> Precision-engineered to meet the exact specifications of your Graco texture sprayer, ensuring optimal performance and safety.</li><li><strong>Bonded Twin-Line Design:</strong> Combines air and material lines into a single, manageable assembly for improved organization and reduced job-site clutter.</li><li><strong>Translucent Construction:</strong> Allows for easy visual inspection of material flow, enabling proactive maintenance and troubleshooting.</li><li><strong>Professional Durability:</strong> Built to endure the high-pressure demands of professional texture spraying, providing a long service life even in harsh conditions.</li><li><strong>Enhanced Maneuverability:</strong> The 25-foot length provides the perfect balance of reach and control for interior and exterior applications.</li></ul><h2>Technical Specifications</h2><p>| Specification | Detail | | :--- | :--- | | Brand | Graco | | SKU | 17J420 | | Hose Type | Bonded Twin-Line (Air & Material) | | Length | 25 feet | | Diameter | 1 inch | | Compatibility | RTX 1500, RTX 2000pi, RTX 5000pi, GTX 2000ex | | Color | Translucent Blue |</p>","Add-on Graco Blue Hose Kit 1"" x 25' for RTX 1500/2000pi/5000pi.",370.00,,https://drywalltoolbox.com/wp/wp-content/uploads/2026/04/Graco/Products/17j420.webp,Texture Tools > Graco > Texture Sprayers,"1"", Graco, spray hose",563,1,0,visible,,,taxable,,1,,,0,0,,,,,1,,,,,,,,,,,Brand,Graco,1,1
