Platinum Drywall Tools,PT-CT36,,"Platinum 36"" Compound Tube (PT-CT36)",simple,"<h2>Elevate Your Drywall Finishing Efficiency</h2><p>Streamline your workflow and achieve professional-grade results with the Platinum 36"" Compound Tube. Engineered for the demands of high-volume drywall finishing, this robust tool acts as a high-capacity delivery system, allowing you to apply joint compound to internal corners, external corners, and flat surfaces with unparalleled speed and consistency. By integrating this tube into your toolkit, you significantly reduce the time spent on manual application, ensuring a cleaner, more uniform finish across every project.</p><h2>Precision Engineering for Professional Results</h2><p>Designed with the professional contractor in mind, the Platinum 36"" Compound Tube functions with the simplicity and reliability of a heavy-duty syringe. Its intuitive design allows for rapid loading directly from your compound bucket, minimizing downtime and mess. The 36-inch length is specifically optimized for maneuverability, providing the perfect balance of reach and control when navigating tight spaces or complex architectural details. Built to withstand the rigors of daily job-site use, this tool is an essential investment for any finisher looking to maximize productivity without sacrificing quality.</p><h2>Key Features</h2><ul><li><strong>High-Capacity Application:</strong> Rapidly draws and dispenses joint compound, drastically cutting down on manual labor time.</li><li><strong>Versatile Compatibility:</strong> Designed to work seamlessly with a variety of applicator heads (sold separately) for corners and flats.</li><li><strong>Optimized Reach:</strong> The 36-inch frame offers the ideal length for accessing hard-to-reach areas while maintaining precise control.</li><li><strong>Durable Construction:</strong> Engineered with premium materials to ensure long-term reliability and consistent performance under heavy use.</li><li><strong>User-Friendly Operation:</strong> Simple pull-handle mechanism allows for quick, effortless filling and smooth compound distribution.</li></ul><h2>Technical Specifications</h2><p>| Specification | Detail | | :--- | :--- | | Brand | Platinum | | SKU | PT-CT36 | | Product Type | Compound Tube | | Length | 36 inches | | Application | Internal/External Corners and Flats | | Price | $155.00 |</p>","The Platinum 36"" Compound Tube applies joint compound to corners and flats with an applicator head (sold separately). Well-built for high productivity.",155.00,,https://drywalltoolbox.com/wp/wp-content/uploads/2026/04/Platinum/Products/PT-CT36_519f96aa.webp,Drywall Finishing Tools > Platinum > Tools,"Platinum, pt-ct36",1413,1,0,visible,,,taxable,,1,,,,0,,,,,1,,,,,,,,,,,Brand,Platinum,1,1,"<p><strong>Platinum 36"" Compound Tube (PT-CT36)</strong> provides a high-capacity, semi-automatic solution for drywall finishers who require speed and consistency on the job site. This tool functions as a heavy-duty delivery system, allowing for the rapid application of joint compound to internal corners, external corners, and flat surfaces. By streamlining the mud-loading and application process, it significantly reduces manual labor time compared to traditional hand-taping methods.</p><p>Engineered for professional environments, this compound tube operates with the reliability of a large-scale syringe. The 36-inch length is specifically calibrated to offer an optimal balance of reach and maneuverability, making it effective for navigating tight spaces and complex architectural details. The tool is designed for durability, ensuring it withstands the daily rigors of high-volume finishing work while maintaining smooth, consistent performance.</p><p><strong>Features:</strong></p><ul><li><strong>High-Capacity Delivery:</strong> Rapidly draws and dispenses joint compound, minimizing downtime and increasing overall project throughput.</li><li><strong>Versatile Compatibility:</strong> Features a universal design that integrates seamlessly with a wide range of applicator heads, corner flushers, and finishers (sold separately).</li><li><strong>Optimized Reach:</strong> The 36-inch frame provides the necessary length for accessing hard-to-reach areas while maintaining precise control over compound placement.</li><li><strong>Durable Construction:</strong> Built with robust materials to ensure long-term reliability and consistent operation under heavy, daily use.</li><li><strong>Intuitive Operation:</strong> Simple pull-handle mechanism allows for quick, effortless filling directly from a compound bucket and smooth distribution on the wall.</li></ul><p><strong>Technical Specifications:</strong></p><p>| Specification | Detail | | :--- | :--- | | Brand | Platinum | | SKU | PT-CT36 | | Product Type | Compound Tube | | Length | 36 inches | | Application | Internal/External Corners and Flats | | Price | $155.00 |</p>","The Platinum 36"" Compound Tube is a high-capacity, professional-grade tool designed for the rapid application of joint compound to corners and flat surfaces. Compatible with various applicator heads, it offers superior reach and durability for efficient drywall finishing."
Platinum Drywall Tools,PT-AICA,,Platinum Wheel Inside Angle / Corner Applicator (PT-AICA),simple,"<h2>Achieve Flawless Inside Corners with Precision</h2><p>Elevate your drywall finishing standards with the Platinum 4-Wheel Inside Angle Applicator. Engineered for professionals who demand speed without sacrificing quality, this tool streamlines the taping process, ensuring that every inside corner is finished with professional-grade consistency. By reducing the need for manual touch-ups, this applicator significantly boosts your daily productivity on the job site.</p><h2>Superior Design for Seamless Results</h2><p>The standout feature of this applicator is its specialized four-wheel configuration, which provides unparalleled stability and tracking as you move along wall joints. This design allows the tool to glide smoothly over various surfaces, preventing the common skips and uneven mud distribution found with inferior equipment. Constructed from premium, high-durability materials, it is built to withstand the rigorous demands of daily construction environments.</p><h2>Key Features</h2><ul><li><strong>Four-Wheel Stability:</strong> The advanced wheel system ensures the applicator stays centered and balanced, delivering a uniform coat of compound every time.</li><li><strong>Effortless Maneuverability:</strong> Designed to glide across inside angles, minimizing operator fatigue during long finishing sessions.</li><li><strong>Universal Compatibility:</strong> Engineered to work seamlessly with a wide range of corner bead types and sizes, offering maximum versatility for diverse project requirements.</li><li><strong>Professional-Grade Durability:</strong> Crafted from high-quality components to ensure long-term reliability and consistent performance under heavy use.</li><li><strong>Efficiency Focused:</strong> Significantly reduces finishing time, allowing for faster project turnaround without compromising on the final aesthetic.</li></ul><h2>Technical Specifications</h2><p>| Specification | Detail | | :--- | :--- | | Brand | Platinum | | SKU | PT-AICA | | Product Type | 4-Wheel Inside Angle / Corner Applicator | | Category | Drywall Finishing Tools | | Price | $89.00 |</p>",The Platinum 4-Wheel Inside Angle/Corner Applicator makes taping and finishing inside angles and corners easy and efficient. Compatible with various corner bead types.,89.00,,https://drywalltoolbox.com/wp/wp-content/uploads/2026/04/Platinum/Products/PT-AICA_c3a12474.webp,Drywall Finishing Tools > Platinum > Tools,"Platinum, pt-aica",1414,1,0,visible,,,taxable,,1,,,,0,,,,,1,,,,,,,,,,,Brand,Platinum,1,1,"<p><strong>Platinum Wheel Inside Angle / Corner Applicator (PT-AICA)</strong> provides drywall professionals with a reliable method for applying joint compound to interior corners. This tool is engineered to deliver a consistent, uniform layer of mud, effectively minimizing the need for manual touch-ups and accelerating the finishing process. By utilizing a specialized four-wheel configuration, the applicator maintains steady contact with the wall surface, ensuring smooth tracking and preventing the skips or uneven distribution often encountered with standard equipment.</p><p>Constructed for the rigors of daily job site use, this applicator features durable materials designed to withstand heavy-duty operation. Its design prioritizes operator efficiency, allowing for faster project completion while maintaining high-quality standards. The applicator is compatible with various corner bead types, offering the versatility required for diverse residential and commercial finishing tasks.</p><p><strong>Features:</strong></p><ul><li><strong>Four-Wheel Stability:</strong> The integrated wheel system keeps the applicator centered and balanced, ensuring a consistent compound application across the entire length of the corner.</li><li><strong>Smooth Maneuverability:</strong> Engineered to glide effortlessly along inside angles, this design reduces physical strain and operator fatigue during extended finishing sessions.</li><li><strong>Professional-Grade Construction:</strong> Built using high-quality, durable components to ensure long-term reliability and consistent performance under demanding conditions.</li><li><strong>Versatile Compatibility:</strong> Designed to work effectively with a wide range of corner bead sizes and types, providing flexibility for various project requirements.</li></ul><p><strong>Technical Specifications:</strong></p><p>| Specification | Detail | | :--- | :--- | | Brand | Platinum | | SKU | PT-AICA | | Product Type | 4-Wheel Inside Angle / Corner Applicator | | Category | Drywall Finishing Tools | | Price | $89.00 |</p>","The Platinum Wheel Inside Angle / Corner Applicator (PT-AICA) features a four-wheel design for stable, consistent mud application in interior corners, improving speed and finish quality."
Platinum Drywall Tools,PT-FA,,"Platinum 4"" Flat Applicator (PT-FA)",simple,"<h2>Achieve Flawless Drywall Finishes with Precision</h2><p>Elevate your finishing workflow with the Platinum 4"" Flat Applicator. Engineered for professionals who demand consistency and speed, this tool is designed to deliver smooth, uniform compound application across flat joints. Whether you are working on residential renovations or large-scale commercial projects, this applicator provides the reliability needed to achieve a professional-grade finish with every pass.</p><h2>Built for Performance and Durability</h2><p>Constructed to withstand the rigors of daily job site use, the Platinum Flat Applicator balances lightweight handling with robust structural integrity. Its ergonomic design minimizes operator fatigue during extended use, while the precision-engineered blade ensures optimal compound distribution, significantly reducing the need for excessive sanding or rework. This is an essential addition to any drywall finisher's toolkit, streamlining your process and enhancing overall project quality.</p><h2>Key Features</h2><ul><li><strong>Precision Application:</strong> Engineered to lay down a consistent, even layer of joint compound for seamless finishing.</li><li><strong>Professional Grade:</strong> Designed specifically for the demands of high-volume drywall installation and repair.</li><li><strong>Ergonomic Design:</strong> Optimized for comfort and control, allowing for steady, fluid motions across flat surfaces.</li><li><strong>Durable Construction:</strong> Built with high-quality materials to ensure longevity and consistent performance under heavy use.</li><li><strong>Efficiency Focused:</strong> Reduces application time and material waste, helping you complete projects faster and more profitably.</li></ul><h2>Technical Specifications</h2><p>| Specification | Detail | | :--- | :--- | | Brand | Platinum | | SKU | PT-FA | | Tool Type | Flat Applicator | | Size | 4 Inches | | Category | Drywall Finishing Tools | | Price | $59.00 |</p>","Platinum 4"" Flat Applicator for compact seam finishing. Compatible with standard flat box handles from major brands.",59.00,,https://drywalltoolbox.com/wp/wp-content/uploads/2026/04/Platinum/Products/PT-FA_c3f41750.webp,Drywall Finishing Tools > Platinum > Tools,"Platinum, pt-fa",1415,1,0,visible,,,taxable,,1,,,,0,,,,,1,,,,,,,,,,,Brand,Platinum,1,1,"<p><strong>Platinum 4"" Flat Applicator (PT-FA)</strong> provides professional-grade precision for drywall finishing, specifically engineered for coating seams, butt joints, and fastener rows. Its compact 4-inch design is ideal for navigating tight areas and performing detailed pre-fill work where larger tools are impractical. Built to withstand the demands of high-volume job sites, this applicator features a lightweight, anodized aluminum body that balances durability with ease of handling, helping to minimize operator fatigue during extended use.</p><p>This tool is designed for seamless integration into existing professional setups, offering broad compatibility with compound tubes, angle boxes, and MudRunners from major industry brands including TapeTech, Columbia, Drywall Master, NorthStar, and Level5. By delivering a consistent, uniform layer of joint compound, the applicator reduces the necessity for excessive sanding or rework, ultimately streamlining the finishing process and improving overall project efficiency.</p><p><strong>Features:</strong></p><ul><li><strong>Precision Application:</strong> Engineered to distribute a consistent, even layer of joint compound for seamless, professional-grade finishes.</li><li><strong>Universal Compatibility:</strong> Designed to work seamlessly with compound tubes, angle boxes, and MudRunners from leading drywall tool manufacturers.</li><li><strong>Compact Design:</strong> The 4-inch width is optimized for tight spaces, detail work, and efficient pre-fill applications.</li><li><strong>Durable Construction:</strong> Crafted from high-quality, lightweight anodized aluminum to ensure long-term reliability under heavy, daily use.</li><li><strong>Warranty Protection:</strong> Backed by a 5-year manufacturer's warranty, providing long-term assurance for professional contractors.</li></ul><p><strong>Technical Specifications:</strong></p><p>| Specification | Detail | | :--- | :--- | | Brand | Platinum Drywall Tools | | SKU | PT-FA | | Tool Type | Flat Applicator | | Size | 4 Inches | | Material | Anodized Aluminum | | Warranty | 5-Year Limited Warranty |</p>","Platinum 4"" Flat Applicator (PT-FA) for precision seam and butt joint finishing. Features a durable, lightweight anodized aluminum body compatible with major industry compound tubes and angle boxes."
Platinum Drywall Tools,PT-CT42,,"Platinum 42"" Compound Tube (PT-CT42)",simple,"<h2>Professional-Grade Precision for Drywall Finishing</h2><p>Elevate your drywall finishing workflow with the Platinum 42"" Compound Tube. Engineered for the demanding professional, this tool is designed to streamline the application of joint compound, ensuring consistent, high-quality results across every seam. Its robust construction provides the reliability needed for high-volume job sites, allowing you to work faster and with greater accuracy than traditional manual methods.</p><h2>Built for Efficiency and Control</h2><p>This compound tube is an essential asset for contractors looking to minimize fatigue and maximize output. The 42-inch length offers an ideal reach for standard wall heights, reducing the need for constant repositioning. By delivering a controlled flow of compound directly to your finishing heads, this tool helps maintain a clean workspace and significantly reduces material waste, making it a smart investment for any professional drywall toolkit.</p><h2>Key Features</h2><ul><li><strong>Optimized Reach:</strong> The 42-inch design provides excellent coverage for walls and ceilings, minimizing the need for ladders or stilts.</li><li><strong>Durable Construction:</strong> Built with high-quality materials to withstand the rigors of daily professional use.</li><li><strong>Consistent Flow:</strong> Engineered for smooth, reliable compound delivery to ensure a uniform finish every time.</li><li><strong>Ergonomic Design:</strong> Balanced for comfort, allowing for extended use with reduced physical strain.</li><li><strong>Seamless Integration:</strong> Compatible with standard industry finishing heads for versatile application.</li></ul><h2>Technical Specifications</h2><p>| Specification | Detail | | :--- | :--- | | Brand | Platinum | | SKU | PT-CT42 | | Product Type | Compound Tube | | Length | 42 inches | | Category | Drywall Finishing Tools | | Price | $160.00 |</p>","Platinum 42"" Compound Tube for reaching high walls and ceilings. Works with all major brand applicator heads (sold separately).",160.00,,https://drywalltoolbox.com/wp/wp-content/uploads/2026/04/Platinum/Products/PT-CT42_1869f3d1.webp,Drywall Finishing Tools > Platinum > Tools,"Platinum, pt-ct42",1416,1,0,visible,,,taxable,,1,,,,0,,,,,1,,,,,,,,,,,Brand,Platinum,1,1,"<p><strong>Platinum 42"" Compound Tube (PT-CT42)</strong> provides contractors with a reliable, high-capacity solution for applying joint compound to wall and ceiling seams. Designed for heavy-duty job site conditions, this tool facilitates a steady, controlled flow of material, which helps maintain consistent coverage while minimizing the physical exertion associated with manual finishing techniques.</p><p>The 42-inch length is optimized to provide extended reach, allowing for efficient work on standard wall heights without the constant need for repositioning ladders or stilts. By delivering compound directly to the finishing head, the unit reduces material waste and keeps the workspace cleaner. Its balanced construction is intended to support long periods of operation, making it a practical addition for professionals focused on output and finish quality.</p><p><strong>Features:</strong></p><ul><li><strong>Extended Reach:</strong> The 42-inch frame provides sufficient length to cover high wall and ceiling areas efficiently.</li><li><strong>Durable Build:</strong> Constructed with high-grade materials to endure the demands of daily professional use.</li><li><strong>Consistent Delivery:</strong> Engineered for a smooth, reliable flow of compound to ensure uniform application across all joints.</li><li><strong>Universal Compatibility:</strong> Designed to integrate seamlessly with standard industry finishing heads.</li><li><strong>Ergonomic Balance:</strong> The tool is weighted to reduce operator fatigue during extended finishing tasks.</li></ul><p><strong>Technical Specifications:</strong></p><p>| Specification | Detail | | :--- | :--- | | Brand | Platinum | | SKU | PT-CT42 | | Product Type | Compound Tube | | Length | 42 inches | | Category | Drywall Finishing Tools | | Price | $160.00 |</p>","The Platinum 42"" Compound Tube offers extended reach for high-wall and ceiling finishing. Compatible with standard applicator heads, this durable tool ensures consistent compound delivery and reduced material waste."
Platinum Drywall Tools,PT-BH42,,"Platinum 42"" Flat Box Handle (PT-BH42)",simple,"<h2>Elevate Your Drywall Finishing Precision</h2><p>Achieve professional-grade results with the Platinum 42-inch Flat Box Handle, an essential tool engineered for high-output drywall contractors. Designed to bridge the gap between reach and maneuverability, this handle provides the stability required for flawless seams on both walls and ceilings. By utilizing premium materials and an intuitive design, it empowers finishers to maintain high standards of quality throughout demanding workdays.</p><h2>Built for Performance and Longevity</h2><p>Constructed from high-grade anodized aluminum, this handle offers a superior strength-to-weight ratio. The lightweight profile significantly reduces operator fatigue, allowing for extended periods of use without sacrificing control. The fixed 42-inch length ensures a consistent, reliable feel, eliminating the mechanical play often found in adjustable models and providing a direct, responsive connection to your flat box.</p><h2>Key Features</h2><ul><li><strong>Professional-Grade Construction:</strong> Crafted from durable, anodized aluminum to withstand the rigors of daily job site use while resisting corrosion.</li><li><strong>Optimized Length:</strong> The fixed 42-inch design offers the perfect balance of reach for high walls and ceilings while maintaining excellent leverage for lower applications.</li><li><strong>Ergonomic Handling:</strong> Features a comfortable grip designed to minimize hand strain and improve maneuverability during repetitive finishing strokes.</li><li><strong>Secure Attachment System:</strong> Engineered for a rock-solid connection to your flat box, ensuring smooth, chatter-free operation and consistent mud application.</li><li><strong>Fatigue Reduction:</strong> The lightweight architecture allows for precise, fluid movements, helping you maintain productivity from start to finish.</li></ul><h2>Technical Specifications</h2><p>| Specification | Detail | | :--- | :--- | | Brand | Platinum | | SKU | PT-BH42 | | Material | Anodized Aluminum | | Handle Length | 42 inches | | Tool Type | Flat Box Handle | | Category | Drywall Finishing Tools | | Price | $95.00 |</p>","The Platinum 42"" Flat Box Handle is built from lightweight anodized aluminum with ergonomic grip and secure attachment design for consistent flat box results.",95.00,,https://drywalltoolbox.com/wp/wp-content/uploads/2026/04/Platinum/Products/PT-BH34_e35382a4.webp,Drywall Finishing Tools > Platinum > Tools,"Platinum, pt-bh42",1417,1,0,visible,,,taxable,,1,,,,0,,,,,1,,,,,,,,,,,Brand,Platinum,1,1,"<p><strong>Platinum 42"" Flat Box Handle (PT-BH42)</strong> provides the consistent, rigid control required for high-efficiency drywall finishing. Engineered for professionals who prioritize reliability, this fixed-length handle eliminates the mechanical play often associated with adjustable models, ensuring a direct and responsive connection to your flat box. The 42-inch length is specifically calibrated to offer optimal leverage and reach, making it an ideal choice for finishing walls and standard ceilings without the need for additional equipment.</p><p>Constructed from high-grade anodized aluminum, this tool balances structural integrity with a lightweight profile to minimize operator fatigue during extended shifts. The design focuses on fluid, chatter-free operation, allowing for precise mud application and a superior finish on every joint. Its robust build quality ensures it withstands the daily demands of active job sites while maintaining its performance over time.</p><p><strong>Features:</strong></p><ul><li><strong>Fixed-Length Precision:</strong> The 42-inch design provides a stable, consistent feel that enhances control and eliminates the movement common in telescoping handles.</li><li><strong>Durable Construction:</strong> Manufactured from anodized aluminum to resist corrosion and endure the rigors of professional use.</li><li><strong>Ergonomic Design:</strong> Features a comfortable grip engineered to reduce hand strain and improve maneuverability during repetitive finishing strokes.</li><li><strong>Universal Compatibility:</strong> Designed to securely attach to all major brands of drywall flat boxes, ensuring seamless integration into your existing tool set.</li><li><strong>Fatigue Reduction:</strong> The lightweight architecture allows for fluid, effortless movement, helping maintain productivity throughout the workday.</li></ul><p><strong>Technical Specifications:</strong></p><p>| Specification | Detail | | :--- | :--- | | Brand | Platinum | | SKU | PT-BH42 | | Material | Anodized Aluminum | | Handle Length | 42 inches | | Tool Type | Flat Box Handle | | Category | Drywall Finishing Tools |</p>","The Platinum 42"" Flat Box Handle features a rigid, fixed-length design crafted from lightweight anodized aluminum, offering professional-grade control, reduced fatigue, and universal compatibility with major flat box brands."
