Brands,SKU,MPN,Name,Type,Description,Short description,Regular price,Sale price,Images,Categories,Tags,Position,Published,Is featured?,Visibility in catalog,Date sale price starts,Date sale price ends,Tax status,Tax class,In stock?,Stock,Low stock amount,Backorders allowed?,Sold individually?,Weight (lbs),Length (in),Width (in),Height (in),Allow customer reviews?,Purchase note,Shipping class,Download limit,Download expiry days,Parent,Grouped products,Upsells,Cross-sells,External URL,Button text,Attribute 1 name,Attribute 1 value(s),Attribute 1 visible,Attribute 1 global,description_full,description_short
Platinum Drywall Tools,PT-10FB,,"Platinum 10"" Flat Finishing Box (PT-10FB)",simple,"<h2>Achieve Flawless Drywall Finishes with Precision</h2><p>Elevate your drywall finishing workflow with the Platinum 10"" Flat Finishing Box. Engineered for contractors who demand consistency and speed, this tool streamlines the application of joint compound, allowing you to feather edges on both flat and butt joints in a single, fluid motion. By automating the distribution of compound, you can significantly reduce manual labor while ensuring a professional-grade finish that minimizes the need for extensive sanding.</p><h2>Advanced Control for Every Coat</h2><p>Whether you are applying the initial base coat or performing final touch-ups, the Platinum Finishing Box offers the versatility required for multi-stage finishing. The integrated crown adjustment dial provides granular control over the amount of compound dispensed, allowing you to tailor the thickness to your specific project needs. Combined with a high-performance pivoting axle, this tool adapts to the surface contours of your walls, ensuring uniform coverage and superior results across every seam.</p><h2>Key Features</h2><ul><li><strong>Precision Dispensing:</strong> Automatically applies the ideal volume of joint compound for consistent, professional-grade results.</li><li><strong>Efficient Feathering:</strong> Simultaneously applies and feathers edges on flat and butt joints to save time on every pass.</li><li><strong>Adjustable Crown Dial:</strong> Easily modify the compound thickness to accommodate different stages of the finishing process.</li><li><strong>Pivoting Axle Design:</strong> Enhances maneuverability and ensures the blade maintains optimal contact with the wall surface.</li><li><strong>Professional Durability:</strong> Built to withstand the rigors of daily job site use while maintaining high-precision performance.</li></ul><h2>Technical Specifications</h2><p>| Specification | Detail | | :--- | :--- | | Brand | Platinum | | SKU | PT-10FB | | Tool Type | Flat Finishing Box | | Size | 10 Inches | | Application | Drywall Joint Finishing | | Price | $195.00 |</p>","The Platinum 10"" Flat Finishing Box applies compound and feathers edges of butt joints and flat joints in one pass. Features adjustable crown dial and pivoting axle.",195.00,,https://drywalltoolbox.com/wp/wp-content/uploads/2026/04/Platinum/Products/PT-10FB_7316520b.webp,Drywall Finishing Tools > Platinum > Tools,"Platinum, pt-10fb",1403,1,0,visible,,,taxable,,1,,,,0,,,,,1,,,,,,,,,,,Brand,Platinum,1,1,"<p><strong>Platinum 10"" Flat Finishing Box (PT-10FB)</strong> provides professional-grade efficiency for drywall contractors seeking consistent, high-speed joint finishing. This tool is engineered to apply joint compound and feather edges on both flat and butt joints in a single, fluid pass, significantly reducing manual labor and the requirement for extensive post-application sanding. Its robust construction ensures it holds up to the demands of daily job site use while maintaining the precision necessary for high-quality results.</p><p>The unit features an integrated crown adjustment dial, allowing for granular control over the volume of compound dispensed. This versatility enables contractors to easily adapt the thickness of the application to suit the specific requirements of base coats or final touch-ups. A high-performance pivoting axle is incorporated into the design, ensuring the blade maintains optimal contact with the wall surface even when encountering minor irregularities, resulting in uniform coverage across every seam.</p><p><strong>Features:</strong></p><ul><li><strong>Precision Dispensing:</strong> Automatically regulates the volume of joint compound for a consistent, professional finish on every pass.</li><li><strong>Integrated Feathering:</strong> Simultaneously applies and feathers edges on flat and butt joints to maximize productivity.</li><li><strong>Adjustable Crown Dial:</strong> Offers precise control over compound thickness, accommodating different stages of the finishing process.</li><li><strong>Pivoting Axle Design:</strong> Enhances maneuverability and ensures the blade maintains consistent contact with uneven wall surfaces.</li><li><strong>Durable Construction:</strong> Built with high-quality materials to withstand the rigors of professional, daily job site environments.</li></ul><p><strong>Technical Specifications:</strong></p><p>| Specification | Detail | | :--- | :--- | | Brand | Platinum | | SKU | PT-10FB | | Tool Type | Flat Finishing Box | | Size | 10 Inches | | Application | Drywall Joint Finishing | | Price | $195.00 |</p>","The Platinum 10"" Flat Finishing Box streamlines drywall finishing by applying and feathering compound in one pass. Features an adjustable crown dial for thickness control and a pivoting axle for consistent surface contact."
Platinum Drywall Tools,PT-FB12,,"Platinum 12"" Flat Finishing Box (PT-FB12)",simple,"<h2>Achieve Professional Drywall Perfection</h2><p>Elevate your drywall finishing workflow with the Platinum 12"" Flat Finishing Box. Engineered for contractors who demand precision and efficiency, this tool streamlines the application of joint compound, ensuring a consistent, high-quality finish on every seam. Whether you are tackling a large-scale commercial project or a residential renovation, this finishing box provides the control and reliability needed to produce seamless walls with minimal effort.</p><h2>Advanced Engineering for Superior Results</h2><p>This second-generation finishing box is built to outperform standard industry tools. The integrated adjustable crown dial allows for granular control over compound thickness, enabling you to dial in the perfect amount for base coats or final finishes. To combat the challenges of imperfect framing, the precision-engineered pivoting axle automatically adjusts to surface irregularities, preventing skips and ensuring a smooth, level application across the entire span of the joint.</p><h2>Key Features</h2><ul><li><strong>Adjustable Crown Control:</strong> Fine-tune your compound application with a simple dial adjustment, perfect for transitioning between initial fill coats and final skimming.</li><li><strong>Pivoting Axle Technology:</strong> Automatically compensates for uneven drywall surfaces, delivering a professional-grade finish even on challenging substrates.</li><li><strong>Simplified Maintenance:</strong> The innovative removable door plate design replaces outdated hinge systems, allowing for rapid disassembly and thorough cleaning after every job.</li><li><strong>Universal Compatibility:</strong> Designed with versatility in mind, all wear parts are compatible with most major industry-standard finishing boxes, ensuring long-term serviceability.</li><li><strong>Rugged Construction:</strong> Built to withstand the rigors of daily job site use, providing consistent performance and durability for the professional finisher.</li></ul><h2>Technical Specifications</h2><p>| Specification | Detail | | :--- | :--- | | Brand | Platinum | | SKU | PT-FB12 | | Tool Type | 12"" Flat Finishing Box | | Category | Drywall Finishing Tools | | Price | $205.00 | | Compatibility | Universal (Major Industry Brands) |</p>","The Platinum 12"" Flat Finishing Box features a second-generation design with removable door plate, adjustable crown dial, and pivoting axle. Wear parts compatible with most major brands.",205.00,,https://drywalltoolbox.com/wp/wp-content/uploads/2026/04/Platinum/Products/PT-FB12_1778f435.webp,Drywall Finishing Tools > Platinum > Tools,"Platinum, pt-fb12",1404,1,0,visible,,,taxable,,1,,,,0,,,,,1,,,,,,,,,,,Brand,Platinum,1,1,"<p><strong>Platinum 12"" Flat Finishing Box (PT-FB12)</strong> provides professional-grade efficiency for drywall finishing, designed to streamline the application of joint compound across flat and butt joints. This tool is built for contractors who require consistent, high-quality results on both large-scale commercial projects and residential renovations, offering the control necessary to achieve a seamless finish with reduced physical strain.</p><p>This second-generation finishing box features a robust construction engineered for daily job site demands. The integrated adjustable crown dial allows for precise control over compound thickness, facilitating smooth transitions between base coats and final skimming. To ensure reliable performance on imperfect framing, the precision-engineered pivoting axle automatically compensates for surface irregularities, preventing skips and maintaining a level application across the entire joint span.</p><p><strong>Features:</strong></p><ul><li><strong>Adjustable Crown Control:</strong> Fine-tune compound application with a simple dial, allowing for exact thickness adjustments between initial fill coats and final finishes.</li><li><strong>Pivoting Axle Technology:</strong> Automatically adapts to uneven drywall surfaces to ensure a consistent, professional-grade finish on challenging substrates.</li><li><strong>Simplified Maintenance:</strong> The removable door plate design eliminates outdated hinge systems, enabling rapid disassembly and thorough cleaning after every use.</li><li><strong>Universal Compatibility:</strong> Engineered with wear parts that are compatible with most major industry-standard finishing boxes, ensuring long-term serviceability and ease of maintenance.</li><li><strong>Rugged Construction:</strong> Built from durable materials to withstand the rigors of professional job site environments.</li></ul><p><strong>Technical Specifications:</strong></p><p>| Specification | Detail | | :--- | :--- | | Brand | Platinum | | SKU | PT-FB12 | | Tool Type | 12"" Flat Finishing Box | | Category | Drywall Finishing Tools | | Compatibility | Universal (Major Industry Brands) | | Price | $205.00 |</p>","The Platinum 12"" Flat Finishing Box features a second-generation design with a removable door plate, adjustable crown dial, and pivoting axle for consistent, professional-grade drywall finishing. Compatible with most major industry-standard wear parts."
Platinum Drywall Tools,PT-14FB,,"Platinum 14"" Flat Finishing Box (PT-14FB)",simple,"<h2>Professional-Grade Precision for Seamless Drywall Finishing</h2><p>Achieve a flawless, mirror-smooth finish on every seam with the Platinum 14"" Flat Finishing Box. Engineered for the professional contractor who demands consistency and speed, this high-capacity tool streamlines the taping and finishing process, significantly reducing manual labor time. Its robust construction ensures it can withstand the rigors of daily job site use while delivering the precise mud application required for high-end residential and commercial projects.</p><h2>Optimized for Efficiency and Control</h2><p>The 14-inch width provides an ideal footprint for covering wide joints and feathering edges with minimal effort. By maintaining a consistent mud flow and pressure, this finishing box eliminates the common inconsistencies associated with hand-tooling, allowing you to achieve a professional level of flatness that is ready for sanding and painting. The ergonomic design ensures that even during extended use, the tool remains balanced and easy to maneuver across walls and ceilings.</p><h2>Key Features</h2><ul><li><strong>High-Capacity Design:</strong> The 14-inch width allows for maximum coverage per pass, drastically increasing your daily output.</li><li><strong>Consistent Mud Application:</strong> Precision-engineered gates ensure an even distribution of compound, reducing the need for touch-ups.</li><li><strong>Durable Build Quality:</strong> Crafted from premium materials to resist wear and tear in demanding construction environments.</li><li><strong>Professional Finish:</strong> Designed to produce a smooth, feathered edge that minimizes sanding time and improves final paint results.</li><li><strong>User-Centric Ergonomics:</strong> Balanced weight distribution reduces operator fatigue during long finishing sessions.</li></ul><h2>Technical Specifications</h2><p>| Specification | Detail | | :--- | :--- | | Brand | Platinum | | SKU | PT-14FB | | Tool Type | Flat Finishing Box | | Width | 14 inches | | Category | Drywall Finishing Tools | | Price | $215.00 |</p>","The Platinum 14"" Flat Finishing Box applies compound and feathers edges in one pass. Features adjustable crown dial, pivoting axle, and universal handle compatibility.",215.00,,https://drywalltoolbox.com/wp/wp-content/uploads/2026/04/Platinum/Products/PT-14FB_9633c392.webp,Drywall Finishing Tools > Platinum > Tools,"Platinum, pt-14fb",1405,1,0,visible,,,taxable,,1,,,,0,,,,,1,,,,,,,,,,,Brand,Platinum,1,1,"<p><strong>Platinum 14"" Flat Finishing Box (PT-14FB)</strong> is a high-capacity automatic tool designed for professional drywall contractors who require efficiency and consistent results on large-scale projects. This finishing box streamlines the application of joint compound, allowing for rapid coverage of flat seams and butt joints while simultaneously feathering the edges to a precise crown. By automating the mud distribution process, it significantly reduces the time spent on manual hand-tooling and subsequent sanding, ensuring a professional-grade finish ready for final coating.</p><p>Constructed from durable, high-strength aluminum, this tool is built to endure the demanding conditions of daily job site use while maintaining a balanced, lightweight feel to minimize operator fatigue. The precision-engineered stainless steel blade and skid plates provide a smooth, uniform compound flow, effectively eliminating ridges and voids. Designed for versatility, the unit is compatible with most major brands of flat box handles, making it a seamless addition to any existing professional tool arsenal.</p><p><strong>Features:</strong></p><ul><li><strong>High-Capacity 14-Inch Width:</strong> Maximizes surface coverage per pass, significantly increasing daily output on both walls and ceilings.</li><li><strong>Precision Compound Control:</strong> Features an adjustable crown dial that allows for exact regulation of mud thickness, ensuring consistent results and reduced rework.</li><li><strong>Durable Construction:</strong> Engineered with high-strength aluminum and precision-ground stainless steel components to resist wear and provide long-term reliability.</li><li><strong>Universal Compatibility:</strong> Designed to integrate easily with standard and extendable flat box handles from most major industry manufacturers.</li><li><strong>Ergonomic Design:</strong> Balanced weight distribution facilitates smooth operation and reduces physical strain during extended finishing sessions.</li></ul><p><strong>Technical Specifications:</strong></p><p>| Specification | Detail | | :--- | :--- | | Brand | Platinum | | SKU | PT-14FB | | Tool Type | Flat Finishing Box | | Width | 14 inches | | Category | Drywall Finishing Tools | | Price | $215.00 |</p>","The Platinum 14"" Flat Finishing Box delivers high-capacity, consistent compound application for rapid drywall seam and butt joint finishing. Featuring a durable aluminum body, adjustable crown settings, and universal handle compatibility, it is engineered to increase productivity and minimize sanding."
Platinum Drywall Tools,PT-2NS,,"Platinum 2"" Nail Spotter (PT-2NS)",simple,"<h2>Precision Finishing for Every Fastener</h2><p>Elevate your drywall finishing workflow with the Platinum 2"" Nail Spotter. Engineered specifically for the demands of professional contractors, this compact, high-performance tool streamlines the process of coating nail and screw heads. By delivering a consistent, uniform finish in a single pass, it eliminates the need for tedious manual touch-ups, allowing you to achieve a flawless, paint-ready surface with unmatched speed and efficiency.</p><h2>Built for the Job Site</h2><p>Constructed from premium-grade anodized aluminum, this tool is designed to withstand the rigors of daily professional use while remaining lightweight and easy to maneuver. The integrated steel blade ensures a clean, sharp finish, while the high-quality urethane door seal provides a reliable, leak-free operation. With its smooth-glide wheel system, the Platinum Nail Spotter offers effortless tracking, ensuring you maintain professional-grade results from the first fastener to the last.</p><h2>Key Features</h2><ul><li><strong>Professional Efficiency:</strong> Designed to rapidly coat nail and screw heads, significantly reducing labor time on large-scale drywall projects.</li><li><strong>Durable Construction:</strong> Crafted from high-grade anodized aluminum for superior corrosion resistance and long-term structural integrity.</li><li><strong>Precision Blade:</strong> Equipped with a hardened steel blade to ensure a clean, flush finish every time.</li><li><strong>Reliable Sealing:</strong> Features a high-performance urethane door seal to prevent leakage and maintain consistent pressure.</li><li><strong>Smooth Operation:</strong> Engineered with precision-glide wheels for steady, fluid movement across wall surfaces.</li></ul><h2>Technical Specifications</h2><p>| Specification | Detail | | :--- | :--- | | Brand | Platinum | | SKU | PT-2NS | | Tool Type | 2"" Nail Spotter | | Material | Anodized Aluminum / Steel | | Category | Drywall Finishing Tools | | Price | $160.00 |</p>","The Platinum 2"" Nail Spotter provides fast, consistent coating over nail and screw heads. High-grade anodized aluminum body, urethane door seal, and steel blade.",160.00,,https://drywalltoolbox.com/wp/wp-content/uploads/2026/04/Platinum/Products/PT-2NS_f1a9da8a.webp,Drywall Finishing Tools > Platinum > Tools,"Platinum, pt-2ns",1406,1,0,visible,,,taxable,,1,,,,0,,,,,1,,,,,,,,,,,Brand,Platinum,1,1,"<p><strong>Platinum 2"" Nail Spotter (PT-2NS)</strong> is a specialized tool designed to optimize the drywall finishing process by automating the application of joint compound over fastener indentations. By allowing contractors to fill and finish entire rows of screw or nail heads in a single, fluid pass, this tool significantly reduces the labor-intensive nature of manual touch-ups. It is engineered to deliver a consistent, uniform finish that minimizes the need for subsequent sanding, ensuring a high-quality, paint-ready surface on every project.</p><p>Constructed from durable, anodized aluminum, the tool balances structural integrity with a lightweight profile, making it suitable for demanding, high-volume job site environments. The design incorporates a precision-hardened steel blade for clean, flush results and a high-performance urethane door seal that maintains consistent internal pressure while preventing compound leakage. A smooth-glide wheel system ensures steady tracking across wall surfaces, providing the control necessary for professional-grade results.</p><p><strong>Features:</strong></p><ul><li><strong>Operational Efficiency:</strong> Enables rapid, single-pass coating of fastener heads, drastically cutting down on manual labor time for large-scale drywall installations.</li><li><strong>Robust Build:</strong> Manufactured from high-grade anodized aluminum to provide excellent corrosion resistance and long-term durability under heavy use.</li><li><strong>Precision Finishing:</strong> Features a hardened steel blade engineered to produce a clean, flush finish on every pass.</li><li><strong>Leak-Resistant Design:</strong> Utilizes a high-performance urethane door seal to maintain consistent pressure and prevent compound waste.</li><li><strong>Fluid Movement:</strong> Equipped with a precision-glide wheel system that ensures steady, consistent tracking across drywall surfaces.</li></ul><p><strong>Technical Specifications:</strong></p><p>| Specification | Detail | | :--- | :--- | | Brand | Platinum | | SKU | PT-2NS | | Tool Type | 2"" Nail Spotter | | Material | Anodized Aluminum / Steel | | Category | Drywall Finishing Tools | | Price | $160.00 |</p>","The Platinum 2"" Nail Spotter streamlines drywall finishing by applying a consistent, uniform coat over fastener heads in a single pass. Built with durable anodized aluminum, a precision steel blade, and a reliable urethane seal for professional-grade efficiency."
Platinum Drywall Tools,PT-CF2.5,,"Platinum 2.5"" Angle Head with Wheels (PT-CF2.5)",simple,"<h2>Achieve Flawless Inside Corners with Precision Engineering</h2><p>Elevate your drywall finishing standards with the Platinum 2.5"" Angle Head. Designed for professionals who demand consistency and speed, this robust tool streamlines the process of finishing inside corners. By applying a uniform coat of compound to both sides of a corner simultaneously, it eliminates the need for tedious manual touch-ups, ensuring a crisp, professional edge that is ready for a final sand and paint.</p><h2>Superior Performance and Durability</h2><p>Constructed from high-grade cast aluminum, this angle head is built to withstand the rigors of daily job site use while maintaining its structural integrity. The integrated wheel system allows for effortless gliding, whether you are utilizing it in tandem with a corner roller or mounting it to a corner box. Its intuitive design reduces operator fatigue and significantly increases productivity, making it an essential asset for any high-efficiency drywall finishing workflow.</p><h2>Key Features</h2><ul><li><strong>Precision Finishing:</strong> Simultaneously coats and finishes both sides of an inside corner for a perfectly sharp, uniform result.</li><li><strong>Durable Construction:</strong> Crafted from premium cast aluminum to ensure long-term reliability and resistance to wear.</li><li><strong>Smooth Operation:</strong> Integrated wheels provide a consistent, fluid motion across various surfaces, minimizing drag and maximizing control.</li><li><strong>Versatile Compatibility:</strong> Engineered to perform seamlessly when used with corner rollers or corner boxes for a complete finishing system.</li><li><strong>Time-Saving Efficiency:</strong> Dramatically reduces the time spent on manual corner detailing, allowing for a faster transition to the painting phase.</li></ul><h2>Technical Specifications</h2><p>| Specification | Detail | | :--- | :--- | | Brand | Platinum | | SKU | PT-CF2.5 | | Tool Type | Angle Head / Corner Finisher | | Size | 2.5 inches | | Material | Cast Aluminum | | Category | Drywall Finishing Tools |</p>","Platinum 2.5"" Angle Head Corner Finisher with cast-aluminum design for smooth inside corners in a single pass. Compatible with corner rollers and corner boxes.",239.00,,https://drywalltoolbox.com/wp/wp-content/uploads/2026/04/Platinum/Products/PT-CF2.5_a6afa209.webp,Drywall Finishing Tools > Platinum > Tools,"Platinum, pt-cf2.5",1407,1,0,visible,,,taxable,,1,,,,0,,,,,1,,,,,,,,,,,Brand,Platinum,1,1,"<p><strong>Platinum 2.5"" Angle Head with Wheels (PT-CF2.5)</strong> provides a professional-grade solution for finishing inside 90-degree drywall corners. Engineered for high-volume environments, this tool simultaneously applies and feathers joint compound on both sides of an internal angle, ensuring a uniform, sharp finish that minimizes the need for manual sanding or touch-up work. By automating the glazing process, it allows for a faster transition to final surface preparation.</p><p>Built for the demands of daily job site use, the unit features a robust cast aluminum body that balances structural rigidity with operational longevity. The integrated wheel system is designed to provide fluid, consistent movement across the wall surface, reducing drag and operator fatigue during extended use. This angle head is compatible with standard corner rollers, corner boxes, and angle head handles, making it a versatile addition to any professional drywall finishing system.</p><p><strong>Features:</strong></p><ul><li><strong>Precision Finishing:</strong> Simultaneously coats and feathers both sides of an inside corner for a clean, uniform edge.</li><li><strong>Durable Construction:</strong> Manufactured from high-grade cast aluminum to ensure long-term reliability and resistance to job site wear.</li><li><strong>Fluid Operation:</strong> Integrated wheels facilitate smooth, consistent motion, minimizing surface drag and improving control.</li><li><strong>System Compatibility:</strong> Designed to integrate seamlessly with standard corner rollers and corner boxes for a complete finishing workflow.</li><li><strong>Efficiency Gains:</strong> Significantly reduces manual detailing time, accelerating the overall finishing schedule.</li></ul><p><strong>Technical Specifications:</strong></p><p>| Specification | Detail | | :--- | :--- | | Brand | Platinum | | SKU | PT-CF2.5 | | Tool Type | Angle Head / Corner Finisher | | Size | 2.5 inches | | Material | Cast Aluminum | | Category | Drywall Finishing Tools |</p>","Platinum 2.5"" Angle Head with Wheels delivers a consistent, feathered finish on inside 90-degree corners in a single pass. Built from durable cast aluminum with integrated wheels for smooth, low-drag operation, it is compatible with standard corner boxes and rollers."
