Platinum Drywall Tools,PT-CRE,,Platinum ECO Inside Corner Roller (PT-CRE),simple,"<h2>Achieve Flawless Inside Corners with Ease</h2><p>Elevate your drywall finishing process with the Platinum ECO Inside Corner Roller. Designed for professionals and DIY enthusiasts alike, this tool streamlines the embedding of corner tape, ensuring a crisp, professional finish every time. By combining lightweight construction with high-performance materials, this roller minimizes fatigue while maximizing the quality of your interior wall transitions.</p><h2>Precision Engineering for Superior Results</h2><p>Forget the frustration of damaged corner beads or uneven tape application. The ECO Inside Corner Roller features specialized nylon rollers that glide effortlessly over your work, providing consistent pressure without marring the surface. Its intuitive design allows for rapid, uniform results, significantly reducing the time spent on manual smoothing and touch-ups.</p><h2>Key Features</h2><ul><li><strong>Non-Marring Nylon Rollers:</strong> Engineered to apply firm, even pressure to corner tape while protecting delicate corner beads from scratches or indentations.</li><li><strong>Universal Compatibility:</strong> Features a standard threaded connection that fits most common painter’s poles and broom handles, allowing you to reach high corners without a ladder.</li><li><strong>Ergonomic Efficiency:</strong> Lightweight and balanced, this tool is built to reduce wrist and arm strain during extended finishing projects.</li><li><strong>Durable Construction:</strong> Built to withstand the rigors of daily job site use, ensuring long-term reliability for your drywall toolkit.</li><li><strong>Seamless Integration:</strong> Designed to work harmoniously with standard drywall finishing workflows, making it an essential addition for any professional contractor.</li></ul><h2>Technical Specifications</h2><p>| Specification | Detail | | :--- | :--- | | Brand | Platinum | | SKU | PT-CRE | | Tool Type | Inside Corner Roller | | Material | Nylon Rollers | | Compatibility | Standard Coarse Thread Poles | | Price | $59.00 | | Category | Drywall Finishing Tools |</p>",The Platinum ECO Inside Corner Roller features nylon rollers for smooth corner finishing. Attaches to any standard coarse thread painter's pole or broom handle.,59.00,,https://drywalltoolbox.com/wp/wp-content/uploads/2026/04/Platinum/Products/PT-CRE_4e69c1aa.webp,Drywall Finishing Tools > Platinum > Tools,"Platinum, pt-cre",1428,1,0,visible,,,taxable,,1,,,,0,,,,,1,,,,,,,,,,,Brand,Platinum,1,1,"<p><strong>Platinum ECO Inside Corner Roller (PT-CRE)</strong> provides a reliable solution for embedding drywall tape into interior corners. This tool is engineered to press tape firmly into the corner angle, effectively removing air pockets and excess joint compound to ensure a sharp, professional 90-degree finish. By utilizing specialized nylon rollers, the tool applies consistent pressure across the tape surface, preventing damage to the corner bead or the tape itself during the application process.</p><p>The design prioritizes operational efficiency, allowing for rapid movement along vertical and horizontal corner seams. Its lightweight construction helps minimize physical fatigue during extended taping sessions, while the universal threaded connection ensures compatibility with standard painter’s poles and broom handles for extended reach. This tool is built to withstand the demands of frequent job site use, offering a practical addition to any professional or DIY drywall finishing kit.</p><p><strong>Features:</strong></p><ul><li><strong>Non-Marring Nylon Rollers:</strong> Engineered to apply firm, uniform pressure while protecting delicate corner beads and tape from surface damage or indentations.</li><li><strong>Universal Threaded Connection:</strong> Compatible with most standard coarse-thread painter’s poles and broom handles, facilitating easy access to high corners without the need for ladders.</li><li><strong>Ergonomic Design:</strong> Balanced and lightweight to reduce wrist and arm strain during repetitive finishing tasks.</li><li><strong>Durable Build:</strong> Constructed to endure the rigors of daily professional use, ensuring long-term reliability and consistent performance.</li></ul><p><strong>Technical Specifications:</strong></p><p>| Specification | Detail | | :--- | :--- | | Brand | Platinum | | SKU | PT-CRE | | Tool Type | Inside Corner Roller | | Material | Nylon Rollers | | Compatibility | Standard Coarse Thread Poles | | Category | Drywall Finishing Tools |</p>","The Platinum ECO Inside Corner Roller features nylon rollers for smooth, precise tape embedding in 90-degree corners. Designed with a universal threaded connection for use with standard extension poles."
Platinum Drywall Tools,PT-EXT3IN1-1,,Platinum Extendable Angle Head Handle (PT-EXT3IN1-1),simple,"<h2>Elevate Your Drywall Finishing Precision</h2><p>Achieve flawless corners and reach challenging heights with the Platinum Extendable Angle Head Handle. Engineered for professional drywall contractors who demand both versatility and durability, this tool eliminates the need for cumbersome ladders or scaffolding. Its robust yet lightweight design ensures you maintain total control during extended use, reducing fatigue while maximizing your daily output.</p><h2>Built for the Demanding Job Site</h2><p>Crafted from premium-grade aluminum, this handle offers the perfect balance of structural integrity and portability. The telescoping mechanism operates smoothly, allowing for rapid adjustments between 45 and 70 inches to accommodate varying ceiling heights and tight corner configurations. Outfitted with ergonomic grips, it provides a secure, comfortable hold that minimizes hand strain, even during high-volume finishing tasks.</p><h2>Key Features</h2><ul><li><strong>Telescoping Versatility:</strong> Effortlessly adjusts from 45 to 70 inches, providing the reach necessary for high walls and vaulted ceilings.</li><li><strong>Lightweight Aluminum Construction:</strong> High-grade materials ensure a durable, corrosion-resistant build that remains easy to maneuver throughout the workday.</li><li><strong>Ergonomic Handling:</strong> Designed with comfortable, non-slip grips to enhance control and reduce operator fatigue.</li><li><strong>Professional-Grade Reliability:</strong> Engineered to withstand the rigors of daily job site use, ensuring consistent performance for long-term projects.</li><li><strong>Seamless Integration:</strong> Compatible with standard angle heads, making it an essential addition to any professional drywall finishing kit.</li></ul><h2>Technical Specifications</h2><p>| Specification | Detail | | :--- | :--- | | Brand | Platinum | | SKU | PT-EXT3IN1-1 | | Product Type | Extendable Angle Head Handle | | Material | High-grade Aluminum | | Adjustable Length | 45"" - 70"" | | Price | $75.00 |</p>","Platinum Extendable Angle Head Handle adjusts from 45–70"" for reaching high work and tight spaces. High-grade lightweight aluminum with comfortable grips.",75.00,,https://drywalltoolbox.com/wp/wp-content/uploads/2026/04/Platinum/Products/PT-EXT3IN1-1_dff530ee.webp,Drywall Finishing Tools > Platinum > Tools,"Platinum, pt-ext3in1-1",1429,1,0,visible,,,taxable,,1,,,,0,,,,,1,,,,,,,,,,,Brand,Platinum,1,1,"<p><strong>Platinum Extendable Angle Head Handle (PT-EXT3IN1-1)</strong> provides professional-grade reach and control for drywall finishing applications. Designed to eliminate the need for ladders or scaffolding, this tool allows contractors to efficiently finish high corners and vaulted ceilings with precision. The handle is constructed from high-grade aluminum, offering a balance of structural durability and lightweight maneuverability to reduce operator fatigue during high-volume projects.</p><p>The telescoping mechanism allows for rapid length adjustments between 45 and 70 inches, ensuring compatibility with various ceiling heights and tight corner configurations. Outfitted with ergonomic, non-slip grips, the handle provides a secure hold, while its design ensures seamless integration with standard angle heads and corner finishers.</p><p><strong>Features:</strong></p><ul><li><strong>Telescoping Adjustment:</strong> Quickly extends from 45 to 70 inches to accommodate diverse job site requirements and reach challenging areas.</li><li><strong>Durable Construction:</strong> Manufactured from high-grade aluminum for a corrosion-resistant, long-lasting build that remains lightweight for daily use.</li><li><strong>Ergonomic Design:</strong> Features non-slip grips to enhance handling control and minimize hand strain during extended finishing tasks.</li><li><strong>Universal Compatibility:</strong> Engineered to integrate seamlessly with standard industry angle heads and corner finishing tools.</li></ul><p><strong>Technical Specifications:</strong></p><p>| Specification | Detail | | :--- | :--- | | Brand | Platinum | | SKU | PT-EXT3IN1-1 | | Product Type | Extendable Angle Head Handle | | Material | High-grade Aluminum | | Adjustable Length | 45"" - 70"" | | Price | $75.00 |</p>","Platinum Extendable Angle Head Handle features a 45–70"" telescoping range for high-reach drywall finishing. Built from lightweight, durable aluminum with ergonomic grips for professional control."
Platinum Drywall Tools,PT-EBH,,"Platinum Extendable Flat Box Handle 40"" – 64"" (PT-EBH)",simple,"<h2>Elevate Your Drywall Finishing Precision</h2><p>Experience the perfect balance of durability and maneuverability with the Platinum Extendable Flat Box Handle. Engineered specifically for the rigorous demands of professional drywall contractors, this tool is designed to streamline your workflow while ensuring a flawless, professional-grade finish on every seam. By combining high-strength materials with an intuitive, adjustable design, this handle empowers you to tackle high-reach applications with confidence and ease.</p><h2>Built for the Professional Contractor</h2><p>Constructed from premium-grade anodized aluminum, this handle offers an exceptional strength-to-weight ratio, effectively reducing operator fatigue during long shifts. The telescopic design provides seamless length adjustment from 40 to 64 inches, allowing you to transition effortlessly between standard wall heights and elevated ceiling work. A robust, integrated locking mechanism guarantees rock-solid stability at any setting, preventing slippage and ensuring the consistent pressure required for a smooth, uniform compound application.</p><h2>Key Features</h2><ul><li><strong>Precision Engineering:</strong> Crafted from lightweight, corrosion-resistant anodized aluminum for long-term durability in harsh job-site environments.</li><li><strong>Versatile Reach:</strong> Telescopic adjustment range of 40"" to 64"" provides the flexibility needed for diverse wall and ceiling configurations.</li><li><strong>Secure Locking System:</strong> Features a reliable, high-tension locking mechanism that maintains your chosen length securely throughout the finishing process.</li><li><strong>Ergonomic Control:</strong> Designed to provide superior leverage and tactile feedback, allowing for precise control of your flat box for a professional, streak-free finish.</li><li><strong>Professional Compatibility:</strong> Optimized for seamless integration with standard flat boxes, making it an essential upgrade for any drywall finishing kit.</li></ul><h2>Technical Specifications</h2><p>| Specification | Detail | | :--- | :--- | | Brand | Platinum | | SKU | PT-EBH | | Product Type | Extendable Flat Box Handle | | Material | Anodized Aluminum | | Adjustable Length | 40"" – 64"" | | Category | Drywall Finishing Tools | | Price | $169.00 |</p>","The Platinum Extendable Flat Box Handle adjusts from 40"" to 64"" with a secure locking mechanism. Lightweight anodized aluminum for smooth, consistent finishes.",169.00,,https://drywalltoolbox.com/wp/wp-content/uploads/2026/04/Platinum/Products/PT-EBH_de691736.webp,Drywall Finishing Tools > Platinum > Tools,"Platinum, pt-ebh",1430,1,0,visible,,,taxable,,1,,,,0,,,,,1,,,,,,,,,,,Brand,Platinum,1,1,"<p><strong>Platinum Extendable Flat Box Handle 40"" – 64"" (PT-EBH)</strong> provides the reach and control necessary for high-efficiency drywall finishing. Designed for contractors who require consistent performance across varying ceiling heights and wall configurations, this handle minimizes the need for stilts or ladders by offering a versatile adjustment range. Its construction prioritizes durability and operator comfort, ensuring that the tool remains reliable throughout demanding work shifts.</p><p>Built from high-grade anodized aluminum, this handle offers a lightweight profile that reduces physical strain without sacrificing structural integrity. The telescopic mechanism allows for rapid length adjustments, while the integrated locking system ensures the handle remains fixed at the desired setting, providing the stability required for uniform compound application and streak-free results. It is engineered to integrate seamlessly with standard flat finishing boxes, making it a practical addition to any professional finishing kit.</p><p><strong>Features:</strong></p><ul><li><strong>Telescopic Versatility:</strong> Adjustable length from 40 to 64 inches allows for effortless transitions between standard wall work and elevated ceiling applications.</li><li><strong>Durable Construction:</strong> Manufactured from anodized aluminum to resist corrosion and withstand the rigors of daily job-site use while maintaining a lightweight feel.</li><li><strong>Secure Locking Mechanism:</strong> A high-tension lock ensures the handle stays firmly at the selected length, preventing slippage and maintaining consistent pressure during operation.</li><li><strong>Ergonomic Control:</strong> Designed to provide superior leverage and tactile feedback, facilitating precise handling and professional-grade finishing.</li></ul><p><strong>Technical Specifications:</strong></p><p>| Specification | Detail | | :--- | :--- | | Brand | Platinum | | SKU | PT-EBH | | Product Type | Extendable Flat Box Handle | | Material | Anodized Aluminum | | Adjustable Length | 40"" – 64"" | | Category | Drywall Finishing Tools |</p>","The Platinum Extendable Flat Box Handle features a 40"" to 64"" telescopic range and a secure locking system. Constructed from lightweight, corrosion-resistant anodized aluminum, it is designed for consistent, professional-grade drywall finishing."
Platinum Drywall Tools,PT-ICA,,Platinum Inside 90 Degree Applicator (PT-ICA),simple,"<h2>Achieve Flawless Interior Corners with Precision</h2><p>Elevate your drywall finishing workflow with the Platinum Inside 90 Degree Applicator. Engineered for professionals who demand consistency and speed, this applicator head streamlines the process of applying joint compound to interior corners. By ensuring an even, uniform distribution of material, it significantly reduces the need for extensive sanding and touch-ups, allowing you to move through your projects with greater efficiency and confidence.</p><h2>Built for the Demanding Job Site</h2><p>Durability is at the core of the Platinum design philosophy. This applicator head is constructed from high-grade materials capable of withstanding the rigors of daily professional use. Whether you are tackling a residential renovation or a large-scale commercial build, this tool provides the reliable performance required to maintain a high standard of finish across every corner of the room.</p><h2>Key Features</h2><ul><li><strong>Precision Engineering:</strong> Specifically calibrated for 90-degree interior corners to ensure a perfect fit and consistent compound thickness.</li><li><strong>Professional Finish:</strong> Delivers a smooth, professional-grade application that minimizes waste and maximizes productivity.</li><li><strong>Robust Construction:</strong> Crafted for longevity, ensuring the tool maintains its shape and performance over extended periods of heavy-duty use.</li><li><strong>Seamless Integration:</strong> Designed to work effortlessly with standard drywall finishing equipment for a streamlined, intuitive user experience.</li><li><strong>Time-Saving Efficiency:</strong> Significantly accelerates the taping and finishing process, allowing for faster project completion without sacrificing quality.</li></ul><h2>Technical Specifications</h2><p>| Specification | Detail | | :--- | :--- | | Brand | Platinum | | SKU | PT-ICA | | Product Type | Inside 90 Degree Applicator | | Category | Drywall Finishing Tools | | Price | $59.00 |</p>","The Platinum Inside 90 Degree Applicator Head applies joint compound effortlessly on interior corners. Precision-crafted for smooth, professional-grade finishes.",59.00,,https://drywalltoolbox.com/wp/wp-content/uploads/2026/04/Platinum/Products/PT-ICA_3f4f7b92.webp,Drywall Finishing Tools > Platinum > Tools,"Platinum, pt-ica",1431,1,0,visible,,,taxable,,1,,,,0,,,,,1,,,,,,,,,,,Brand,Platinum,1,1,"<p><strong>Platinum Inside 90 Degree Applicator (PT-ICA)</strong> is a high-performance tool engineered to streamline the application of joint compound in interior corners. Designed for professionals who prioritize speed and precision, this applicator ensures a uniform distribution of material, significantly reducing the time required for manual smoothing and subsequent sanding. By delivering a consistent bead of compound, it helps maintain a high standard of finish across both residential and commercial drywall projects.</p><p>Built to withstand the rigors of daily job site use, this applicator features a robust construction that retains its shape and performance over extended periods. It integrates seamlessly with standard drywall finishing equipment, providing a reliable, intuitive experience that enhances overall productivity. Whether tackling complex interior angles or standard wall-to-wall corners, this tool provides the accuracy needed to achieve professional-grade results with minimal waste.</p><p><strong>Features:</strong></p><ul><li><strong>Precision Calibration:</strong> Specifically designed for 90-degree interior corners to ensure accurate compound thickness and a perfect fit.</li><li><strong>Professional Efficiency:</strong> Accelerates the taping and finishing workflow, allowing for faster project completion without compromising quality.</li><li><strong>Durable Build:</strong> Constructed from high-grade materials to ensure longevity and consistent performance under heavy-duty conditions.</li><li><strong>Seamless Integration:</strong> Compatible with standard drywall finishing tools for a streamlined and efficient user experience.</li></ul><p><strong>Technical Specifications:</strong></p><p>| Specification | Detail | | :--- | :--- | | Brand | Platinum | | SKU | PT-ICA | | Product Type | Inside 90 Degree Applicator | | Category | Drywall Finishing Tools | | Price | $59.00 |</p>","The Platinum Inside 90 Degree Applicator (PT-ICA) is a professional-grade tool designed for precise, uniform joint compound application in interior corners, significantly increasing speed and finishing quality."
Platinum Drywall Tools,PT-CR,,Platinum Inside Corner Roller (PT-CR),simple,"<h2>Achieve Flawless 90-Degree Corners with Precision</h2><p>The Platinum Inside Corner Roller is an essential instrument for professional drywall finishers who demand perfection in every seam. Engineered to streamline the taping process, this tool ensures that paper tape is seated firmly and uniformly into inside corners, eliminating air pockets and excess compound for a professional-grade finish that stands the test of time.</p><h2>Superior Bedding Performance</h2><p>Designed for efficiency and consistency, this roller allows you to quickly transition from applying joint compound to securing the tape. By applying consistent pressure along the 90-degree angle, the tool effectively forces out trapped air and surplus mud, creating a tight, reliable bond between the tape and the substrate. This critical step sets the stage for a clean, sharp corner that requires minimal sanding and finishing work.</p><h2>Key Features</h2><ul><li><strong>Precision Engineering:</strong> Specifically calibrated for 90-degree inside corners to ensure perfect tape alignment every time.</li><li><strong>Optimized Bonding:</strong> Forces excess joint compound from beneath the tape, ensuring a secure, bubble-free adhesion.</li><li><strong>Workflow Efficiency:</strong> Designed to be used immediately after tape application, significantly reducing the time spent on manual corner finishing.</li><li><strong>Professional Results:</strong> Creates a crisp, sharp corner profile that serves as the ideal foundation for subsequent finishing steps.</li><li><strong>System Compatibility:</strong> Pairs perfectly with corner flushers or angle heads to efficiently remove remaining compound and finalize the corner geometry.</li></ul><h2>Technical Specifications</h2><p>| Specification | Detail | | :--- | :--- | | Brand | Platinum | | SKU | PT-CR | | Product Type | Inside Corner Roller | | Application | Drywall Taping and Finishing | | Corner Angle | 90 Degrees | | Price | $79.99 |</p>","The Platinum Inside Corner Roller embeds paper tape into inside 90-degree corners. Roll over tape to force out excess compound and create a sharp, clean corner.",79.99,,https://drywalltoolbox.com/wp/wp-content/uploads/2026/04/Platinum/Products/PT-CR_e8bbf114.webp,Drywall Finishing Tools > Platinum > Tools,"Platinum, pt-cr",1432,1,0,visible,,,taxable,,1,,,,0,,,,,1,,,,,,,,,,,Brand,Platinum,1,1,"<p><strong>Platinum Inside Corner Roller (PT-CR)</strong> is a professional-grade tool engineered to deliver precise, high-quality results in drywall finishing. Designed specifically for 90-degree inside corners, this roller ensures that paper tape is seated firmly and uniformly against the substrate. By applying consistent pressure, it effectively eliminates air pockets and forces out excess joint compound, creating a clean, sharp corner profile that requires minimal sanding and preparation for subsequent coats.</p><p>Built for durability and performance, this tool is an essential component for any professional drywall finishing workflow. Its design allows for rapid, consistent tape embedding, significantly reducing the labor time compared to manual hand-tooling methods. The roller is compatible with standard corner finishing systems, making it a versatile addition to your tool kit for achieving professional-grade, bubble-free corner seams on every project.</p><p><strong>Features:</strong></p><ul><li><strong>Precision Calibration:</strong> Specifically designed for 90-degree inside corners to ensure accurate tape alignment and a sharp, professional finish.</li><li><strong>Optimized Adhesion:</strong> Effectively removes trapped air and excess compound from beneath the tape, creating a secure, durable bond.</li><li><strong>Workflow Efficiency:</strong> Dramatically accelerates the taping process by replacing time-consuming manual corner work with a single, consistent rolling pass.</li><li><strong>System Compatibility:</strong> Integrates seamlessly with corner flushers and angle heads to finalize corner geometry and prepare surfaces for finishing.</li></ul><p><strong>Technical Specifications:</strong></p><p>| Specification | Detail | | :--- | :--- | | Brand | Platinum | | SKU | PT-CR | | Product Type | Inside Corner Roller | | Application | Drywall Taping and Finishing | | Corner Angle | 90 Degrees | | Price | $79.99 |</p>","The Platinum Inside Corner Roller (PT-CR) is a professional-grade tool designed to firmly embed paper tape into 90-degree inside corners. It efficiently removes air pockets and excess compound, creating a sharp, clean, and durable corner foundation."
