Platinum Drywall Tools,PT-8FB,,"Platinum 8"" Flat Finishing Box (PT-8FB)",simple,"<h2>Achieve Flawless Drywall Finishes with Precision</h2><p>Elevate your drywall installation workflow with the Platinum 8"" Flat Finishing Box. Engineered for professionals who demand consistency and speed, this tool streamlines the application of joint compound, ensuring a smooth, uniform finish across every seam. By automating the distribution of mud, this finishing box significantly reduces manual labor and minimizes the need for extensive sanding, allowing you to achieve a professional-grade result in a fraction of the time.</p><h2>Built for Performance and Reliability</h2><p>Designed to withstand the rigors of high-volume job sites, the Platinum 8"" Flat Finishing Box is constructed from durable, high-quality materials that resist wear and corrosion. Its ergonomic design provides excellent control and balance, reducing operator fatigue during extended use. Whether you are tackling residential renovations or large-scale commercial projects, this tool offers the precision required to meet the highest industry standards for wall and ceiling finishing.</p><h2>Key Features</h2><ul><li><strong>Consistent Compound Application:</strong> Delivers a precise, even layer of joint compound for a superior finish every time.</li><li><strong>Increased Efficiency:</strong> Dramatically accelerates the taping and finishing process compared to traditional hand-tooling methods.</li><li><strong>Durable Construction:</strong> Built with robust materials to ensure long-term reliability in demanding professional environments.</li><li><strong>Ergonomic Handling:</strong> Balanced design promotes ease of use and reduces physical strain during repetitive tasks.</li><li><strong>Professional Results:</strong> Minimizes surface imperfections, creating a seamless base for paint or wallpaper application.</li></ul><h2>Technical Specifications</h2><p>| Specification | Detail | | :--- | :--- | | Brand | Platinum | | SKU | PT-8FB | | Tool Type | Flat Finishing Box | | Size | 8 Inches | | Category | Drywall Finishing Tools | | Price | $185.00 |</p>","The Platinum 8"" Flat Finishing Box applies compound and feathers edges in one pass. Adjustable crown dial and pivoting axle for consistent, professional results.",185.00,,https://drywalltoolbox.com/wp/wp-content/uploads/2026/04/Platinum/Products/PT-8FB_e544b8c4.webp,Drywall Finishing Tools > Platinum > Tools,"Platinum, pt-8fb",1423,1,0,visible,,,taxable,,1,,,,0,,,,,1,,,,,,,,,,,Brand,Platinum,1,1,"<p><strong>Platinum 8"" Flat Finishing Box (PT-8FB)</strong> provides professional-grade efficiency for drywall contractors seeking consistent, high-quality seam finishes. This tool is engineered to simultaneously dispense joint compound and feather the edges in a single, fluid motion, significantly reducing the time required for manual troweling and subsequent sanding. By automating the application process, it ensures a uniform crown across flat and butt joints, creating a seamless surface ready for final finishing.</p><p>Built to withstand the demands of active job sites, this finishing box features a robust design that balances durability with ease of operation. The integrated adjustable crown dial allows for precise control over the amount of compound dispensed, enabling contractors to adapt to varying wall conditions and project requirements. Its ergonomic construction minimizes operator fatigue during extended use, making it a reliable asset for both residential and commercial drywall applications.</p><p><strong>Features:</strong></p><ul><li><strong>Precision Application:</strong> Simultaneously applies and feathers joint compound for a consistent, professional-grade finish on every seam.</li><li><strong>Adjustable Crown Control:</strong> Features a dedicated dial to regulate compound flow, allowing for exact thickness adjustments based on specific project needs.</li><li><strong>Pivoting Axle:</strong> Designed to maintain optimal contact with the wall surface, ensuring smooth performance even on slightly uneven drywall.</li><li><strong>Durable Build:</strong> Constructed from high-quality materials to resist wear and corrosion in rigorous professional environments.</li></ul><p><strong>Technical Specifications:</strong></p><p>| Specification | Detail | | :--- | :--- | | Brand | Platinum | | SKU | PT-8FB | | Tool Type | Flat Finishing Box | | Size | 8 Inches | | Category | Drywall Finishing Tools | | Price | $185.00 |</p>","The Platinum 8"" Flat Finishing Box streamlines drywall finishing by applying and feathering joint compound in one pass. Featuring an adjustable crown dial and a pivoting axle, it delivers consistent, professional results while reducing manual labor."
Platinum Drywall Tools,PT-BF,,Platinum Box Filler Attachment (PT-BF),simple,"<h2>Streamline Your Finishing Workflow</h2><p>Maximize the efficiency of your drywall finishing process with the Platinum Box Filler Attachment. Engineered for professionals who demand reliability on the job site, this essential accessory bridges the gap between your compound pump and your finishing tools. By providing a seamless, high-volume transfer of joint compound, it eliminates the mess and downtime associated with manual filling, allowing you to maintain a consistent pace throughout your workday.</p><h2>Precision Engineering for Heavy-Duty Use</h2><p>Crafted with durability at the forefront, this attachment is built to withstand the rigorous demands of daily professional use. Its robust construction ensures a secure, leak-free connection to your existing pump equipment, providing peace of mind when working with heavy-bodied compounds. Whether you are prepping for a large-scale commercial project or a detailed residential renovation, this tool offers the structural integrity required to perform under pressure.</p><h2>Key Features</h2><ul><li><strong>Universal Compatibility:</strong> Designed to integrate effortlessly with all major brands of drywall compound pumps, ensuring a versatile addition to your existing tool kit.</li><li><strong>Multi-Tool Versatility:</strong> Perfectly suited for filling a wide range of finishing equipment, including flat boxes, corner applicators, and nail spotters.</li><li><strong>Rugged Construction:</strong> Handcrafted for superior longevity, this attachment is built to endure the wear and tear of high-frequency job site environments.</li><li><strong>Optimized Flow:</strong> Engineered to facilitate rapid, clean filling, significantly reducing material waste and saving valuable time during application.</li><li><strong>Secure Attachment:</strong> Features a reliable bolt-on design that maintains a stable, airtight seal for consistent performance across all your drywall finishing tasks.</li></ul><h2>Technical Specifications</h2><p>| Specification | Detail | | :--- | :--- | | Brand | Platinum | | SKU | PT-BF | | Product Type | Box Filler Attachment | | Compatibility | Universal (Major Drywall Pump Brands) | | Primary Use | Filling Flat Boxes, Corner Applicators, Nail Spotters | | Construction | Handcrafted Heavy-Duty Metal |</p>","The Platinum Box Filler Attachment connects to all major drywall compound pumps to fill flat boxes, corner applicators, and nail spotters.",49.00,,https://drywalltoolbox.com/wp/wp-content/uploads/2026/04/Platinum/Products/PT-BF_314fcef3.webp,Drywall Finishing Tools > Platinum > Tools,"Platinum, pt-bf",1424,1,0,visible,,,taxable,,1,,,,0,,,,,1,,,,,,,,,,,Brand,Platinum,1,1,"<p><strong>Platinum Box Filler Attachment (PT-BF)</strong> serves as the critical interface between your compound pump and finishing tools, ensuring a clean, high-volume transfer of joint compound. Designed for the demands of professional drywall finishing, this attachment eliminates the inefficiencies and material waste associated with manual loading, allowing for a seamless workflow across both commercial and residential projects.</p><p>Constructed from heavy-duty, handcrafted metal, this component is engineered to maintain structural integrity under the high-pressure conditions of daily job site use. The design provides a secure, airtight seal that prevents leaks, ensuring that your compound remains contained and your equipment operates at peak performance throughout the day.</p><p><strong>Features:</strong></p><ul><li><strong>Universal Compatibility:</strong> Engineered to integrate with all major brands of drywall compound pumps, providing a versatile solution for your existing tool inventory.</li><li><strong>Multi-Tool Versatility:</strong> Facilitates the rapid filling of a wide array of finishing equipment, including flat boxes, corner applicators, and nail spotters.</li><li><strong>Rugged Construction:</strong> Built with durable, handcrafted metal to withstand the wear and tear of high-frequency, professional environments.</li><li><strong>Optimized Flow:</strong> Designed to support rapid, clean material transfer, which minimizes waste and reduces downtime during application.</li><li><strong>Secure Attachment:</strong> Features a reliable bolt-on design that ensures a stable, leak-free connection for consistent performance.</li></ul><p><strong>Technical Specifications:</strong></p><p>| Specification | Detail | | :--- | :--- | | Brand | Platinum | | SKU | PT-BF | | Product Type | Box Filler Attachment | | Compatibility | Universal (Major Drywall Pump Brands) | | Primary Use | Filling Flat Boxes, Corner Applicators, Nail Spotters | | Construction | Handcrafted Heavy-Duty Metal |</p>","The Platinum Box Filler Attachment provides a secure, leak-free connection to all major drywall compound pumps, enabling rapid and efficient filling of flat boxes, corner applicators, and nail spotters."
Platinum Drywall Tools,PT-2.5CF,,"Platinum Corner Flusher 2.5"" (PT-2.5CF)",simple,"<h2>Achieve Flawless Internal Corners with Precision</h2><p>Elevate your drywall finishing standards with the Platinum 2.5"" Corner Flusher. Engineered for professionals who demand consistency and speed, this tool is an essential addition to your finishing kit. Whether you are applying a smooth base coat or executing a final finish, this flusher ensures uniform compound distribution and crisp, clean angles every single time.</p><h2>Built for Durability and Performance</h2><p>Crafted from premium surgical-grade stainless spring steel, this tool is designed to withstand the rigors of daily job-site use without losing its shape. The high-tension steel construction provides the perfect amount of flex, allowing for seamless feathering and a professional-grade finish that minimizes the need for extensive sanding. Its universal compatibility ensures it integrates effortlessly with your existing inventory of angle head and flusher handles from all major industry brands.</p><h2>Key Features</h2><ul><li><strong>Surgical Stainless Steel Construction:</strong> High-grade material ensures long-term durability, rust resistance, and consistent shape retention.</li><li><strong>Versatile Application:</strong> Optimized for both base coat and final finish coats to streamline your workflow.</li><li><strong>Universal Compatibility:</strong> Designed to fit seamlessly onto all standard major-brand angle head and flusher handles.</li><li><strong>Precision Engineering:</strong> Delivers a consistent 2.5-inch finish, ideal for standard internal corner applications.</li><li><strong>Professional Grade:</strong> Built to meet the high-performance requirements of drywall contractors and finishing specialists.</li></ul><h2>Technical Specifications</h2><p>| Specification | Detail | | :--- | :--- | | Brand | Platinum | | SKU | PT-2.5CF | | Tool Type | Corner Flusher | | Size | 2.5 inches | | Material | Surgical Stainless Spring Steel | | Compatibility | Universal (Major Brand Handles) | | Price | $75.00 |</p>","Platinum 2.5"" Corner Flusher in surgical stainless spring steel for base coat or finish coat. Fits all major brands of angle head or flusher handles.",75.00,,https://drywalltoolbox.com/wp/wp-content/uploads/2026/04/Platinum/Products/PT-2.5CF_ba37654f.webp,Drywall Finishing Tools > Platinum > Tools,"Platinum, pt-2.5cf",1425,1,0,visible,,,taxable,,1,,,,0,,,,,1,,,,,,,,,,,Brand,Platinum,1,1,"<p><strong>Platinum Corner Flusher 2.5"" (PT-2.5CF)</strong> provides professional-grade precision for finishing internal 90-degree drywall corners. Designed to streamline the finishing process, this tool effectively embeds tape and feathers joint compound in a single pass, significantly reducing the time required for manual sanding and touch-ups. Its compact 2.5-inch width makes it an ideal choice for tight spaces, such as corners near door frames or windows, where larger finishing heads may be impractical.</p><p>Constructed from high-performance surgical-grade stainless spring steel, this flusher offers exceptional durability and resistance to corrosion, ensuring it maintains its shape and performance even under the demanding conditions of daily job-site use. The material provides the necessary tension for consistent compound distribution, while the robust design ensures long-term reliability. This tool is engineered for universal compatibility, allowing it to integrate seamlessly with standard angle head and flusher handles from all major industry manufacturers.</p><p><strong>Features:</strong></p><ul><li><strong>Surgical Stainless Steel Build:</strong> Utilizes high-grade, rust-resistant material that maintains structural integrity and shape over extended use.</li><li><strong>Versatile Finishing:</strong> Optimized for both base coat application and final finish coats to improve overall workflow efficiency.</li><li><strong>Universal Compatibility:</strong> Designed to fit securely onto standard-issue angle head and flusher handles from leading industry brands.</li><li><strong>Precision 2.5-Inch Profile:</strong> Specifically sized for standard internal corner applications and tight architectural spaces.</li></ul><p><strong>Technical Specifications:</strong></p><p>| Specification | Detail | | :--- | :--- | | Brand | Platinum | | SKU | PT-2.5CF | | Tool Type | Corner Flusher | | Size | 2.5 inches | | Material | Surgical Stainless Spring Steel | | Compatibility | Universal (Major Brand Handles) |</p>","Platinum 2.5"" Corner Flusher crafted from surgical-grade stainless spring steel for consistent, professional-grade internal corner finishing. Features universal compatibility with major brand handles."
Platinum Drywall Tools,GN,,Platinum Drywall Gooseneck Adapter (GN),simple,"<h2>Elevate Your Drywall Finishing Efficiency</h2><p>Streamline your workflow with the Platinum Drywall Tools Gooseneck, an essential precision attachment engineered for professional-grade compound pumps. Designed to bridge the gap between your pump and automatic taper, this adapter ensures a seamless, high-volume transfer of joint compound, allowing you to maintain momentum and precision throughout your workday.</p><h2>Built for the Demanding Jobsite</h2><p>Crafted from premium-grade stainless steel, this gooseneck is built to withstand the rigors of daily construction environments. Its robust construction offers superior resistance to corrosion and mechanical wear, ensuring that your equipment remains reliable project after project. The integrated taper rest is thoughtfully finished with protective rubber sleeves, safeguarding your automatic taper against surface marring, scratches, and premature wear during the filling process.</p><h2>Key Features</h2><ul><li><strong>Precision Engineering:</strong> Specifically designed for seamless integration with standard compound pumps to optimize joint compound flow.</li><li><strong>Durable Construction:</strong> Manufactured from high-grade stainless steel for maximum longevity and resistance to jobsite elements.</li><li><strong>Equipment Protection:</strong> Features rubber-sleeved taper rests to prevent damage and maintain the finish of your automatic taper.</li><li><strong>Professional Performance:</strong> Enhances the speed and consistency of your drywall finishing setup.</li><li><strong>Reliable Compatibility:</strong> Engineered by Platinum to meet the rigorous standards of professional drywall contractors.</li></ul><h2>Technical Specifications</h2><p>| Specification | Detail | | :--- | :--- | | Brand | Platinum | | SKU | GN | | Material | High-Grade Stainless Steel | | Category | Drywall Finishing Tools | | Protective Features | Rubber-sleeved taper rest | | Compatibility | Standard Compound Pumps |</p>",The Platinum Gooseneck Adapter fills automatic tapers from compound pumps. Made from high-grade stainless steel with rubber-sleeved taper rest.,59.00,,https://drywalltoolbox.com/wp/wp-content/uploads/2026/04/Platinum/Products/GN_a054d56a.webp,Drywall Finishing Tools > Platinum > Tools,"Platinum, gn",1426,1,0,visible,,,taxable,,1,,,,0,,,,,1,,,,,,,,,,,Brand,Platinum,1,1,"<p><strong>Platinum Drywall Gooseneck Adapter (GN)</strong> serves as the critical link between your compound pump and automatic taper, facilitating the rapid, mess-free transfer of joint compound. Engineered for high-volume finishing environments, this adapter allows contractors to maintain a steady workflow, significantly reducing the downtime associated with manual filling. Its robust design ensures consistent performance, helping you achieve professional-grade results on every seam.</p><p>Constructed from high-grade stainless steel, this adapter is built to endure the harsh conditions of daily jobsite use, offering exceptional resistance to corrosion and mechanical wear. The integrated taper rest is equipped with protective rubber sleeves, specifically designed to prevent surface marring and minimize wear on your automatic taper during the loading process. This attention to detail protects your investment while ensuring reliable, long-term operation.</p><p><strong>Features:</strong></p><ul><li><strong>Precision Flow Control:</strong> Optimized geometry ensures a smooth, consistent transfer of joint compound from the pump to the taper.</li><li><strong>Industrial-Grade Durability:</strong> Manufactured from high-quality stainless steel to withstand heavy-duty use and resist jobsite elements.</li><li><strong>Equipment Protection:</strong> Features rubber-sleeved taper rests that safeguard your automatic taper against scratches and premature wear.</li><li><strong>Universal Compatibility:</strong> Designed to integrate seamlessly with standard compound pumps used by professional drywall contractors.</li></ul><p><strong>Technical Specifications:</strong></p><p>| Specification | Detail | | :--- | :--- | | Brand | Platinum Drywall Tools | | SKU | GN | | Material | High-Grade Stainless Steel | | Category | Drywall Finishing Tools | | Protective Features | Rubber-sleeved taper rest | | Compatibility | Standard Compound Pumps |</p>","The Platinum Drywall Gooseneck Adapter provides a durable, stainless steel connection for efficiently filling automatic tapers from standard compound pumps, featuring protective rubber sleeves to prevent equipment damage."
Platinum Drywall Tools,PT-CP,,Platinum Drywall Pump w/Filler (PT-CP),simple,"<h2>Professional-Grade Efficiency for Drywall Finishing</h2><p>Elevate your workflow with the Platinum Drywall Loading Pump, a robust solution engineered for contractors who demand reliability and precision on the job site. Designed to streamline the filling process, this pump eliminates the downtime associated with manual loading, allowing you to maintain a consistent pace throughout your finishing projects.</p><h2>Built for Longevity and Performance</h2><p>Constructed from premium-grade anodized aluminum, this pump is built to withstand the rigors of daily professional use. The high-quality material selection ensures superior resistance to corrosion and wear, providing a long-lasting tool that maintains its integrity under demanding conditions. By prioritizing durable components, Platinum delivers a dependable piece of equipment that minimizes maintenance requirements and maximizes your return on investment.</p><h2>Key Features</h2><ul><li><strong>Precision Engineering:</strong> Meticulously machined components ensure smooth operation and consistent output every time you use the pump.</li><li><strong>Corrosion-Resistant Build:</strong> The anodized aluminum housing protects against moisture and job site elements, significantly extending the tool's lifespan.</li><li><strong>Universal Compatibility:</strong> Includes a complimentary box filler attachment, allowing for seamless integration with all major brands of flat boxes, corner boxes, and nail spotters.</li><li><strong>Optimized Workflow:</strong> Designed to drastically reduce loading time, enabling faster transitions between finishing tasks.</li><li><strong>Professional Reliability:</strong> A trusted choice for drywall professionals looking to upgrade their equipment with a tool that balances performance with durability.</li></ul><h2>Technical Specifications</h2><p>| Specification | Detail | | :--- | :--- | | Brand | Platinum | | SKU | PT-CP | | Material | Anodized Aluminum | | Included Accessories | Box Filler Attachment | | Compatibility | Major brands of Flat Boxes, Corner Boxes, and Nail Spotters | | Price | $269.00 | | Category | Drywall Finishing Tools |</p>",The Platinum Drywall Loading Pump is precision machined from anodized aluminum for long service life. Includes a free box filler attachment.,269.00,,https://drywalltoolbox.com/wp/wp-content/uploads/2026/04/Platinum/Products/PT-CP_18d98178.webp,Drywall Finishing Tools > Platinum > Tools,"Platinum, pt-cp",1427,1,0,visible,,,taxable,,1,,,,0,,,,,1,,,,,,,,,,,Brand,Platinum,1,1,"<p><strong>Platinum Drywall Pump w/Filler (PT-CP)</strong> is a heavy-duty tool engineered to streamline the joint compound loading process for professional drywall contractors. By automating the transfer of mud into finishing tools, this pump significantly reduces manual labor and downtime, allowing for a more efficient and consistent workflow on the job site. Its robust construction ensures it can handle the demanding conditions of daily professional use while maintaining precise performance.</p><p>Built with high-quality anodized aluminum, this pump offers exceptional resistance to corrosion and wear, ensuring a long service life even when exposed to moisture and harsh site environments. The design focuses on reliability and ease of maintenance, providing a dependable solution that minimizes equipment downtime. The included box filler attachment ensures seamless compatibility with a wide range of industry-standard flat boxes, corner boxes, and nail spotters, making it a versatile addition to any professional finishing kit.</p><p><strong>Features:</strong></p><ul><li><strong>Precision Construction:</strong> Meticulously machined components provide smooth, reliable operation and consistent material output.</li><li><strong>Corrosion-Resistant Build:</strong> The anodized aluminum housing protects against job site elements, extending the tool's operational lifespan.</li><li><strong>Universal Compatibility:</strong> Comes equipped with a box filler attachment designed to integrate with major brands of flat boxes, corner boxes, and nail spotters.</li><li><strong>Workflow Optimization:</strong> Dramatically decreases loading time, facilitating faster transitions between finishing tasks and reducing operator fatigue.</li></ul><p><strong>Technical Specifications:</strong></p><p>| Specification | Detail | | :--- | :--- | | Brand | Platinum | | SKU | PT-CP | | Material | Anodized Aluminum | | Included Accessories | Box Filler Attachment | | Compatibility | Major brands of Flat Boxes, Corner Boxes, and Nail Spotters | | Category | Drywall Finishing Tools |</p>","The Platinum Drywall Pump w/Filler (PT-CP) is a precision-machined, anodized aluminum loading pump designed for durability and efficiency. It includes a universal box filler attachment for seamless integration with standard drywall finishing tools."
