Type,SKU,Parent SKU,Slug,Name,Published,Visibility in catalog,Short description,Description,Regular price,Tax status,In stock?,Stock,Backorders allowed?,Sold individually?,Weight (lbs),Length (in),Width (in),Height (in),Categories,Tags,Brands,Images,Parent,Position,Attribute 1 name,Attribute 1 value(s),Attribute 1 visible,Attribute 1 global,Attribute 1 used for variations,Attribute 2 name,Attribute 2 value(s),Attribute 2 visible,Attribute 2 global,Attribute 2 used for variations,meta:search_keywords,meta:seo_title,meta:seo_description,meta:seo_canonical,meta:seo_robots,meta:seo_focus_keyword,meta:seo_secondary_keywords,meta:schema_brand,meta:schema_mpn,meta:schema_condition
simple,DXTT-1121,,level-5-nut-6-32-dxtt-1121,Level5 Nut 6 - 32,1,visible,The Level5 Nut 6 - 32 is a high-quality OEM replacement fastener designed for precision fit and long-lasting durability in professional drywall tools. Ensure your equipment remains job-site ready with this essential 6-32 threaded component.,"<p>Level5 Nut 6 - 32 is a precision-engineered replacement fastener designed specifically for Level 5 drywall finishing tools. This high-quality nut ensures a secure fit and reliable performance during demanding finishing tasks, maintaining the structural integrity of your equipment.</p><p>Built to withstand the rigors of professional job sites, this component serves as a direct replacement part to prevent unnecessary downtime. It provides the exact specifications required to keep your finishing tools operating at peak efficiency.</p><p><strong>Features:</strong></p><ul><li><strong>Precision Threading:</strong> Features a standard 6-32 thread size for a perfect, secure fit with compatible Level 5 hardware.</li><li><strong>Durable Construction:</strong> Manufactured from high-grade materials to resist wear and corrosion during heavy use.</li><li><strong>OEM Compatibility:</strong> Specifically designed for seamless integration with the 4-772 model and related Level 5 finishing equipment.</li><li><strong>Reliable Fastening:</strong> Ensures critical tool components remain tightly secured for consistent finishing results.</li></ul>",2.24,taxable,1,,0,0,,,,,Drywall Finishing Tools > Level 5 > Parts,"Level 5, Level 5 MiniShot Parts, Parts",Level 5,,,0,,,,,,,,,,,Level 5 Nut 6,"fastener, hex nut, machine nut, replacement hardware, threaded nut",2026-05-07,v2-production-normalized,Level 5 Nut 6-32 | DXTT-1121 Replacement Part,Secure your Level 5 drywall tools with the 6-32 Nut (DXTT-1121). Precision-threaded for model 4-772 to ensure reliable performance and tool longevity.,/product/level-5-nut-6-32-dxtt-1121/,"index, follow",Level 5 Nut 6-32 DXTT-1121,"6-32 hex nut, drywall tool parts, Level 5 replacement hardware, 4-772 compatible nut, finishing tool fastener"
simple,DXTT-1122,,level-5-minishot-parts-dxtt-1122,Level5 Screw 4 - 40,1,visible,The Level5 Screw 4 - 40 is a high-quality replacement fastener designed for precision fit and long-term durability in Level 5 drywall tools. It is the essential component for maintaining the 4-772 MiniShot and ensuring peak performance on the job.,"<p>Level5 Screw 4 - 40 is a precision-engineered replacement fastener designed specifically for professional drywall finishing equipment. This high-quality component ensures secure assembly and reliable performance for your Level 5 tools, maintaining the structural integrity required for demanding job site conditions. <p>Engineered to meet exact manufacturer specifications, this screw provides a perfect fit for the 4-772 model. Using genuine Level 5 replacement parts helps prevent mechanical failure and extends the operational lifespan of your finishing tools.</p><h3>Features:</h3><ul><li><strong>Precision Threading:</strong> Ensures a secure, vibration-resistant fit within the tool assembly.</li><li><strong>Durable Construction:</strong> Manufactured from high-grade materials to withstand the rigors of professional drywall work.</li><li><strong>Direct Compatibility:</strong> Specifically designed for use with the Level 5 4-772 MiniShot and related assemblies.</li></ul></p>",1.0,taxable,1,,0,0,,,,,Drywall Finishing Tools > Level 5 > Parts,"Level 5, Level 5 MiniShot Parts, Parts",Level 5,,,0,,,,,,,,,,,Level 5 Screw 4,"replacement screw, drywall tool fastener, 4-40 machine screw, tool repair part, assembly screw",2026-05-07,v2-production-normalized,Level 5 Screw 4-40 | Replacement Part for 4-772,Genuine Level 5 Screw 4-40 (DXTT-1122) for the 4-772 MiniShot. Ensure a precision fit and reliable tool performance with this high-grade replacement part.,/product/level-5-minishot-parts-dxtt-1122/,"index, follow",Level 5 Screw 4-40,"DXTT-1122, Level 5 replacement parts, 4-772 screw, drywall tool fasteners, MiniShot repair parts"
simple,DXTT-1123,,level-5-minishot-small-bracket-support-band-dxtt-1123,Level5 Small Bracket for Support Band,1,visible,The Level5 Small Bracket for Support Band is a genuine replacement part designed for the 4-772 assembly to ensure secure tool operation. This durable component provides a precise fit for professional drywall finishing applications.,"<p>Level5 Small Bracket for Support Band is a precision-engineered replacement component designed to maintain the structural integrity of your drywall finishing equipment. This durable bracket ensures the support band remains securely positioned during high-volume application tasks, preventing mechanical shifts that can impact finish quality. Built to withstand the rigors of professional job sites, this authentic Level 5 part provides a seamless fit for specific tool assemblies. It is an essential maintenance item for contractors who require consistent performance and minimal downtime from their finishing tools. <strong>Features:</strong> - <strong>Precision Fit:</strong> Specifically engineered for seamless compatibility with the 4-772 support band assembly. - <strong>Durable Construction:</strong> Manufactured from high-quality materials to resist wear and corrosion in demanding drywall environments. - <strong>Easy Installation:</strong> Designed for quick replacement to minimize tool downtime and keep projects on schedule. - <strong>OEM Reliability:</strong> Genuine Level 5 part ensures factory-standard performance and long-term durability.</p>",4.0,taxable,1,,0,0,,,,,Drywall Finishing Tools > Level 5 > Parts,"Level 5, Level 5 MiniShot Parts, Parts",Level 5,,,0,,,,,,,,,,,Level 5 Finishing Tool Parts,"mounting bracket, support clip, tool fastener, replacement mount",2026-05-07,v2-production-normalized,Level 5 Small Bracket for Support Band | DXTT-1123 Part,"Genuine Level 5 Small Bracket (DXTT-1123) for the 4-772 support band. Durable, precision-fit replacement part for professional drywall finishing tools.",/product/level-5-minishot-small-bracket-support-band-dxtt-1123/,"index, follow",Level 5 Small Bracket DXTT-1123,"Level 5 4-772 parts, drywall tool bracket, support band bracket, Level 5 replacement parts, MiniShot bracket"
simple,DXTT-1124,,level-5-set-screw-6-32x7-9,Level5 Set Screw 6 - 32x7.9,1,visible,Set Screw 6-32x7.9,<p>Set Screw 6-32x7.9</p> <p>Compatible with: 4-772</p>,1.79,taxable,1,,0,0,,,,,Drywall Finishing Tools > Level 5 > Parts,"Level 5, Level 5 MiniShot Parts, Parts",Level 5,,,0,,,,,,,,,,,Level 5 Set Screw 6,,2026-05-07,v2-production-normalized,Level5 Set Screw 6 - 32x7.9 -,Set Screw 6-32x7.9,,"index,follow",Level 5 Set Screw 6-32x7.9 - [DXTT-1124],
simple,DXTT-1126,,level-5-screw-dxtt-1126,Level5 Screw,1,visible,The Level5 Screw (DXTT-1126) is a genuine replacement fastener designed for the 4-772 MiniShot and related drywall finishing tools. It provides a factory-standard fit to maintain tool integrity and professional performance.,"<p>Level5 Screw is a precision-engineered replacement fastener designed specifically for Level 5 drywall finishing equipment. This high-quality component ensures secure assembly and maintains the structural integrity of your tools during intensive professional use.</p><p>This genuine part is manufactured to exact factory specifications, providing a reliable fit for the 4-772 MiniShot and related assemblies. It serves as a critical hardware update to prevent mechanical failure and ensure consistent performance on the job site.</p><h3>Features:</h3><ul><li><strong>OEM Compatibility:</strong> Specifically designed to fit Level 5 model 4-772 and MiniShot tool configurations.</li><li><strong>Durable Construction:</strong> Fabricated from high-strength materials to resist wear and vibration in demanding environments.</li><li><strong>Precision Threading:</strong> Engineered for a secure, flush fit that prevents loosening during operation.</li><li><strong>Direct Replacement:</strong> Simplifies tool maintenance by providing an exact match for original factory hardware.</li></ul>",1.79,taxable,1,,0,0,,,,,Drywall Finishing Tools > Level 5 > Parts,"Level 5, Level 5 MiniShot Parts, Parts",Level 5,,,0,,,,,,,,,,,Level 5 Parts,"replacement fastener, tool screw, mounting bolt, hardware",2026-05-07,v2-production-normalized,Level 5 Screw DXTT-1126 | Genuine Replacement Part,Shop the Level 5 Screw (DXTT-1126). Genuine replacement part for 4-772 MiniShot drywall tools. Ensure secure assembly and professional performance.,/product/level-5-screw-dxtt-1126/,"index, follow",Level 5 Screw DXTT-1126,"Level 5 parts, 4-772 replacement screw, MiniShot repair parts, drywall tool fasteners"
simple,DXTT-1127,,level5-valve-stem-dxtt-1127,Level5 Valve Stem,1,visible,The Level5 Valve Stem is a high-quality replacement part engineered for the 4-772 model to ensure reliable performance and a leak-free seal.,"<p>Level5 Valve Stem is a precision-engineered replacement component designed to maintain the peak performance of professional drywall finishing equipment. This genuine Level 5 part ensures a reliable seal and smooth operation for consistent material flow during intensive application. It serves as a critical maintenance item for professionals who require dependable tool uptime on the job site. <p>Built to withstand the rigors of daily use, this valve stem provides the exact tolerances needed for high-pressure drywall finishing tasks. Replacing worn stems with this authentic component prevents leaks and ensures your equipment operates according to original factory specifications.</p><h3>Features:</h3><ul><li><strong>OEM Compatibility:</strong> Specifically engineered for a perfect fit with the 4-772 model, ensuring seamless integration.</li><li><strong>Durable Construction:</strong> Manufactured from high-grade materials to resist wear and corrosion in demanding environments.</li><li><strong>Precision Flow Control:</strong> Maintains consistent pressure and prevents material leakage for a cleaner finish.</li><li><strong>Easy Installation:</strong> Designed for quick replacement to minimize downtime and keep your project on schedule.</li></ul></p>",13.0,taxable,1,,0,0,,,,,Drywall Finishing Tools > Level 5 > Parts,"Level 5, Level 5 MiniShot Parts, Parts",Level 5,,,0,,,,,,,,,,,Level 5 Parts,"replacement valve, tool stem, flow control valve, drywall tool component",2026-05-07,v2-production-normalized,Level 5 Valve Stem DXTT-1127 | Genuine Replacement Part,"Ensure peak performance with the Level 5 Valve Stem (DXTT-1127). Precision-engineered for the 4-772 model to provide a reliable, leak-free seal.",/product/level5-valve-stem-dxtt-1127/,"index, follow",Level 5 Valve Stem DXTT-1127,"drywall tool parts, Level 5 replacement parts, 4-772 valve stem, drywall pump parts"
simple,DXTT-1128,,level-5-nut-6-32,Level5 Nut 6 - 32,1,visible,Nut 6-32,<p>Nut 6-32</p> <p>Compatible with: 4-772</p>,3.14,taxable,1,,0,0,,,,,Drywall Finishing Tools > Level 5 > Parts,"Level 5, Level 5 MiniShot Parts, Parts",Level 5,,,0,,,,,,,,,,,Level 5 Nut 6,,2026-05-07,v2-production-normalized,Level5 Nut 6 - 32 -,Nut 6-32,,"index,follow",Level 5 Nut 6-32 - [DXTT-1128],
simple,DXTT-1130,,level5-nozzle-assembly-dxtt-1130,Level5 Nozzle Assembly,1,visible,Level5 Nozzle Assembly is a high-performance replacement part engineered for the 4-772 drywall tool. It ensures precise material application and long-term reliability for professional finishing tasks.,"<p>Level5 Nozzle Assembly is a precision-engineered replacement component designed to maintain the peak performance of your professional drywall finishing equipment. This assembly ensures consistent material flow and high-quality results during joint compound application, making it an essential part for maintaining job site efficiency.</p><p>Built to meet the rigorous standards of professional contractors, this component provides a reliable seal and accurate discharge. It is specifically designed for seamless integration with compatible Level 5 tools, ensuring that your equipment operates with the same precision as the day it was purchased.</p><h3>Features:</h3><ul><li><strong>Direct Compatibility:</strong> Engineered specifically for use with the 4-772 model to ensure a perfect fit and reliable operation.</li><li><strong>Durable Construction:</strong> Manufactured from high-quality materials to withstand the abrasive nature of joint compounds and daily professional use.</li><li><strong>Precision Flow Control:</strong> Optimized nozzle geometry provides a steady, even output for superior finishing accuracy.</li><li><strong>Efficient Maintenance:</strong> Designed for quick installation and removal, allowing for fast field replacements and minimal downtime.</li></ul>",175.49,taxable,1,,0,0,,,,,Drywall Finishing Tools > Level 5 > Parts,"Level 5, Level 5 MiniShot Parts, Parts",Level 5,,,0,,,,,,,,,,,Level 5 Parts,"replacement nozzle, applicator tip, discharge assembly, tool head",2026-05-07,v2-production-normalized,Level 5 Nozzle Assembly DXTT-1130 | Replacement Part,Genuine Level 5 Nozzle Assembly (DXTT-1130) for the 4-772 tool. Ensure precise material flow and professional drywall finishing results. In stock now.,/product/level5-nozzle-assembly-dxtt-1130/,"index, follow",Level 5 Nozzle Assembly DXTT-1130,"4-772 replacement parts, drywall tool nozzle, Level 5 MiniShot parts, DXTT-1130 assembly"
simple,DXTT-1132,,level-5-plunger-u-cup-dxtt-1132,Level5 Plunger U - Cup,1,visible,The Level5 Plunger U-Cup is a high-performance replacement seal designed for model 4-772 drywall tools. It ensures an airtight fit and consistent pressure for professional finishing results.,"<p>Level5 Plunger U-Cup is a precision-engineered replacement component designed to maintain the airtight seal and pressure efficiency of your drywall finishing equipment. This durable U-cup ensures consistent compound flow and prevents leaks during high-volume applications. Built to withstand the rigors of professional job sites, this part is essential for restoring the performance of your Level 5 tools. It provides a secure fit and smooth operation, reducing downtime and ensuring a professional finish on every project. <p><strong>Features:</strong></p><ul><li><strong>Precision Fit:</strong> Specifically engineered for compatibility with model 4-772 to ensure a leak-proof seal.</li><li><strong>Durable Construction:</strong> Manufactured from high-quality materials to resist wear from abrasive drywall compounds.</li><li><strong>Optimized Performance:</strong> Maintains consistent internal pressure for smooth, even compound distribution.</li><li><strong>Easy Installation:</strong> Designed for quick replacement to minimize downtime in the field.</li></ul></p>",20.69,taxable,1,,0,0,,,,,Drywall Finishing Tools > Level 5 > Parts,"Level 5, Level 5 MiniShot Parts, Parts",Level 5,,,0,,,,,,,,,,,Level 5 Plunger U,"plunger seal, U-cup gasket, pressure seal, piston cup, hydraulic seal",2026-05-07,v2-production-normalized,Level 5 Plunger U-Cup DXTT-1132 | Seal for 4-772,Genuine Level 5 Plunger U-Cup (DXTT-1132) for model 4-772. Ensure a leak-proof seal and consistent pressure in your drywall finishing tools.,/product/level-5-plunger-u-cup-dxtt-1132/,"index, follow",Level 5 Plunger U-Cup DXTT-1132,"drywall tool parts, plunger seal, U-cup replacement, Level 5 4-772 parts, compound tube seal"
simple,DXTT-1136,,level-5-316-ss-pan-head-slotted-screw-dxtt-1136,Level5 316 SS Pan Head Slotted Screw,1,visible,The Level5 316 SS Pan Head Slotted Screw is a high-grade replacement fastener engineered for maximum corrosion resistance and a precise fit in professional drywall tools. This genuine OEM part ensures your equipment maintains peak performance and structural reliability.,"<p>Level5 316 SS Pan Head Slotted Screw is a precision-engineered replacement fastener designed for high-performance drywall finishing equipment. Manufactured from marine-grade 316 stainless steel, this screw provides superior corrosion resistance and structural integrity in demanding jobsite environments.<p>It is specifically designed for seamless compatibility with the 4-772 assembly, ensuring a secure fit and reliable operation during intensive use. This genuine Level 5 component maintains the factory standards of your professional tools.</p><h3>Features:</h3><ul><li><strong>316 Stainless Steel Construction:</strong> Offers maximum durability and resistance to rust and chemical exposure.</li><li><strong>Pan Head Design:</strong> Provides a low-profile finish with a wide bearing surface for secure fastening.</li><li><strong>Slotted Drive:</strong> Allows for easy installation and adjustment with standard flat-head tools.</li><li><strong>OEM Compatibility:</strong> Engineered specifically for the 4-772 model to ensure perfect alignment and performance.</li></ul></p>",1.79,taxable,1,,0,0,,,,,Drywall Finishing Tools > Level 5 > Parts,"Level 5, Level 5 MiniShot Parts, Parts",Level 5,,,0,,,,,,,,,,,Level 5 Parts,"replacement screw, stainless fastener, machine screw, slotted head bolt",2026-05-07,v2-production-normalized,Level 5 316 SS Pan Head Slotted Screw | DXTT-1136,Genuine Level 5 316 Stainless Steel Pan Head Slotted Screw (DXTT-1136). Marine-grade corrosion resistance for 4-772 drywall tool assemblies.,/product/level-5-316-ss-pan-head-slotted-screw-dxtt-1136/,"index, follow",Level 5 316 SS Pan Head Slotted Screw,"DXTT-1136, 316 stainless steel screw, pan head slotted screw, Level 5 replacement parts, drywall tool fastener"
simple,DXTT-1138,,level-5-cone-spring-dxtt-1138,Level5 Cone Spring,1,visible,"The Level5 Cone Spring (DXTT-1138) is a genuine replacement part engineered to restore precise functionality to your Level5 drywall finishing tools, specifically compatible with model 4-772.","<p>Level5 Cone Spring is an essential replacement component designed to restore optimal functionality to your Level5 drywall finishing tools. This precision-engineered spring ensures consistent performance and extends the lifespan of compatible equipment, minimizing downtime on the job site. It is specifically engineered for seamless integration with Level5 model 4-772 tools, providing a reliable solution for maintaining professional-grade operation.<p><h3>Features:</h3><ul><li><strong>Precision Engineering:</strong> Manufactured to exact specifications for reliable fit and function within Level5 drywall tools.</li><li><strong>Enhanced Durability:</strong> Constructed from robust materials to withstand the rigorous demands of professional use.</li><li><strong>Optimal Performance:</strong> Restores proper tension and action, ensuring smooth and efficient tool operation.</li><li><strong>Direct Compatibility:</strong> Designed for use with Level5 model 4-772, facilitating straightforward replacement.</li><li><strong>Genuine Part:</strong> Ensures authenticity and maintains the integrity of your Level5 equipment.</li></ul></p></p>",2.24,taxable,1,,0,0,,,,,Drywall Finishing Tools > Level 5 > Parts,"Level 5, Level 5 MiniShot Parts, Parts",Level 5,,,0,,,,,,,,,,,Level 5 Cone Spring,"drywall tool spring, replacement spring, compression spring",2026-05-07,v2-production-normalized,Level5 Cone Spring DXTT-1138 | Drywall Tool Replacement Part,"Restore your Level5 drywall tools with the genuine DXTT-1138 Cone Spring. Essential replacement part for model 4-772, ensuring peak performance.",/product/level-5-cone-spring-dxtt-1138/,"index,follow",Level5 Cone Spring DXTT-1138,"Level 5 parts, drywall tool spring, DXTT-1138 replacement, Level 5 MiniShot parts, 4-772 compatible"
simple,DXTT-1141,,level-5-bracket-for-main-band-assembly,Level5 Bracket for Main Band Assembly,1,visible,Bracket for Main Band Assembly,<p>Bracket for Main Band Assembly</p> <p>Compatible with: 4-772</p>,5.84,taxable,1,,0,0,,,,,Drywall Finishing Tools > Level 5 > Parts,"Level 5, Level 5 MiniShot Parts, Parts",Level 5,,,0,,,,,,,,,,,Level 5 Bracket for Main Band Assembly,,2026-05-07,v2-production-normalized,Level5 Bracket for Main Band Assembly -,Bracket for Main Band Assembly,,"index,follow",Level 5 Bracket for Main Band Assembly - [DXTT-1141],
variable,EXTENDABLE-ACCESSORY-HANDLE,,level-5-extendable-accessory-handle-lvl5-ext-hdl,Level5 Extendable Accessory Handle,1,visible,"The Level5 Extendable Accessory Handle features a solid aluminum construction for unmatched jobsite durability and professional-grade reach. This telescoping handle provides a stable, long-lasting connection for corner rollers, finishers, and nail spotters.","<p>Level5 Extendable Accessory Handle is a professional-grade drywall finishing tool engineered for maximum durability and reach on the jobsite. Constructed from high-quality solid aluminum, this handle eliminates the fragility common in fiberglass alternatives, ensuring it withstands the rigors of daily commercial use. The telescoping design allows for seamless adjustment, providing the necessary leverage and height for finishing corners, rolling tape, or spotting nails without the need for scaffolding. Its robust build quality ensures a secure connection to various Level 5 tool heads, maintaining precision and control during every pass. <br/><br/><strong>Features:</strong><ul><li><strong>Solid Aluminum Construction:</strong> Provides superior strength and longevity compared to standard fiberglass handles.</li><li><strong>Extendable Reach:</strong> Telescoping mechanism allows for quick adjustments to reach high walls and ceilings with ease.</li><li><strong>Versatile Compatibility:</strong> Designed to work seamlessly with corner rollers, finishers, applicators, and nail spotters.</li><li><strong>Ergonomic Grip:</strong> Engineered for comfort and reduced fatigue during extended finishing sessions.</li></ul></p>",,taxable,1,,0,0,,,,,Drywall Finishing Tools > Level 5 > Automatic Taping Tools,"4-792, 4-793, 4-794, 4-795, 4-796, 4-798, 4-799, 4-880, 4-881, Automatic Taping Tools, Level 5, No Head, extendable handle, extension pole, handles, level 5, level 5 handle, level5 handles",Level 5,,,0,Type,Corner Applicator Handle | Corner Finisher Handle | Corner Roller Handle | Nail Spotter Handle | No Head,1.0,1.0,1.0,Size,"52"" | 72""",1.0,1.0,1.0,Level 5 Extendable Accessory Handle,"extension pole, telescoping handle, drywall tool handle, applicator pole",2026-05-07,v2-production-normalized,Level 5 Extendable Accessory Handle | Solid Aluminum Reach,"Professional Level 5 Extendable Accessory Handle in 52"" and 72"" sizes. Solid aluminum construction for superior durability over fiberglass poles.",/product/level-5-extendable-accessory-handle-lvl5-ext-hdl/,"index, follow",Level 5 Extendable Accessory Handle,"aluminum drywall handle, telescoping accessory pole, corner roller handle, nail spotter extension"
