Type,SKU,Parent SKU,Slug,Name,Published,Visibility in catalog,Short description,Description,Regular price,Tax status,In stock?,Stock,Backorders allowed?,Sold individually?,Weight (lbs),Length (in),Width (in),Height (in),Categories,Tags,Brands,Images,Parent,Position,Attribute 1 name,Attribute 1 value(s),Attribute 1 visible,Attribute 1 global,Attribute 1 used for variations,Attribute 2 name,Attribute 2 value(s),Attribute 2 visible,Attribute 2 global,Attribute 2 used for variations,meta:search_keywords,meta:seo_title,meta:seo_description,meta:seo_canonical,meta:seo_robots,meta:seo_focus_keyword,meta:seo_secondary_keywords,meta:schema_brand,meta:schema_mpn,meta:schema_condition
simple,4-002,,level5-corner-drywall-compound-roller-cover-4-002,Level5 Corner Drywall Compound Roller Cover Replacement,1,visible,"The Level5 Corner Drywall Compound Roller Cover Replacement features a high-capacity 1/2-inch nap designed to apply joint compound to internal corners with speed and precision. Its unique nap-free center prevents excess buildup, ensuring a clean finish for professional taping.","<p>Level5 Corner Drywall Compound Roller Cover Replacement is a specialized tool engineered to accelerate the application of joint compound to internal corners. This high-performance cover streamlines the taping process by delivering a consistent, heavy layer of mud exactly where it is needed most. The 1/2-inch thick reticulated polypropylene nap is designed to hold up to 50% more compound than standard high-nap rollers, significantly reducing the frequency of re-loading. A unique nap-free center prevents excess buildup at the corner's apex, ensuring a clean and professional finish before tape application. These covers are built for longevity and can be reused multiple times if cleaned thoroughly after each use. For optimal results, prime the cover with painter's tape before the first use to remove any loose manufacturing fibers. <h3>Features:</h3><ul><li><strong>High-Capacity Nap:</strong> The 1/2-inch reticulated composite material holds significantly more compound for maximum efficiency and fewer trips to the bucket.</li><li><strong>Precision Corner Design:</strong> Specifically shaped for 2-inch inside corners with a nap-free center to prevent mud accumulation in the crease.</li><li><strong>Professional Durability:</strong> Built for repeated use; simply clean thoroughly after each session to maintain performance and extend the life of the cover.</li><li><strong>Optimized Compatibility:</strong> Designed for use with LEVEL5 compound roller frames featuring heavy-duty 1/4-inch shafts.</li></ul></p>",22.0,taxable,1,,0,0,0.1,,,,Drywall Finishing Tools > Level 5 > Parts,"4-002, Level 5, Taping & Finishing Tools, compound roller, mud roller, plastering roller",Level 5,,,0,,,,,,,,,,,Drywall Compound Rollers,"mud roller cover, joint compound applicator sleeve, corner nap, plastering roller cover",2026-05-07,v2-production-normalized,Level5 Corner Drywall Compound Roller Cover | SKU 4-002,Replace your 2-inch corner roller cover with this high-capacity 1/2-inch nap. Prevents mud buildup in internal corners. Fits Level5 4-004 frames.,/product/level5-corner-drywall-compound-roller-cover-4-002/,"index, follow",Level5 Corner Drywall Compound Roller Cover,"drywall mud roller, corner compound applicator, internal corner roller, Level 5 4-002, joint compound roller replacement"
simple,4-006,,level5-4-006-corner-drywall-compound-roller-frame,Level5 Corner Drywall Compound Roller with Frame,1,visible,"The Level5 Corner Drywall Compound Roller with Frame features a high-capacity reticulated nap that holds 50% more compound for rapid, even application. This 4-inch professional tool is built with a corrosion-resistant nickel-plated shank and an ergonomic handle for maximum jobsite efficiency.","<p>Level5 Corner Drywall Compound Roller with Frame is a professional-grade tool engineered to accelerate the application of bedding and finishing compounds. This 4-inch wide roller features a specialized 1/2-inch reticulated polypropylene nap that holds significantly more material than standard high-nap rollers, ensuring even distribution across large surface areas.</p><p>Designed for heavy-duty jobsite use, the frame consists of a 1/4-inch nickel-plated steel shank that resists bending and corrosion. The ergonomic handle provides comfort during extended shifts and is fully compatible with Level 5 extendable skimming blade handles for increased reach.</p><h3>Features</h3><ul><li><strong>High-Capacity Nap:</strong> The 1/2-inch thick reticulated composite nap holds up to 50% more compound than traditional rollers for faster coverage.</li><li><strong>Durable Construction:</strong> Features a heavy-duty 1/4-inch diameter nickel-plated steel shank to prevent bending and resist rust.</li><li><strong>Ergonomic Grip:</strong> Solvent-resistant composite handle designed for all-day comfort and reduced hand fatigue.</li><li><strong>Pole Compatibility:</strong> The handle is designed to snap securely onto Level 5 extendable skimming blade handles.</li><li><strong>Precision Application:</strong> The 4-inch width and 3-inch diameter are optimized for applying bedding compound to flat wall seams prior to taping.</li></ul>",35.0,taxable,1,,0,0,0.5,,,,Drywall Finishing Tools > Level 5 > Corner Tools,"4-006, Level 5, Corner Tools, corner applicator, mud applicator, mud roller",Level 5,,,0,,,,,,,,,,,Level 5 Drywall Rollers,"mud applicator, joint compound applicator, paint roller for drywall, skimming roller",2026-05-07,v2-production-normalized,Level 5 4-006 Corner Drywall Compound Roller with Frame,Apply drywall compound 50% faster with the Level 5 4-006 4-inch roller. Features a high-capacity reticulated nap and ergonomic handle for pro finishing.,/product/level5-4-006-corner-drywall-compound-roller-frame/,"index, follow",Level 5 4-006 Corner Roller,"drywall mud roller, compound applicator, 4-inch drywall roller, Level 5 finishing tools"
simple,4-600P,,level5-l5t-full-set-bonus-cases-4-600p,Level5 L5T Full Set with Bonus Tool Cases Set 4 - 600P,1,visible,The Level5 L5T Full Set 4-600P is a complete automatic drywall finishing system designed to maximize job site productivity and finish quality. This professional kit includes a full range of automatic tools plus bonus storage cases for a turnkey finishing solution.,"<p>Level5 L5T Full Set with Bonus Tool Cases Set 4 - 600P is a comprehensive automatic taping and finishing solution engineered for high-volume drywall professionals. This professional-grade kit transitions finishers from manual methods to a high-speed automated workflow, significantly reducing labor time while maintaining consistent joint quality across every seam. By integrating precision-machined automatic tools, contractors can increase their daily output and manage larger project pipelines without compromising on the final finish. This specific configuration provides a turnkey system for those looking to scale their operations and improve job site efficiency. <h3>Features:</h3><ul><li><strong>High-Speed Production:</strong> Drastically reduces the time required for taping and finishing compared to traditional hand tools, allowing for faster project completion.</li><li><strong>Professional Scalability:</strong> Enables contractors to bid on larger commercial and residential projects with confidence in their production capacity and consistency.</li><li><strong>Complete System Integration:</strong> Includes all necessary components for a full taping and finishing cycle, from initial tape application to final skimming and corner finishing.</li><li><strong>Bonus Storage & Hand Tools:</strong> Features premium tool cases for secure transport and organization, alongside a selection of professional hand tools for detailed touch-up work.</li><li><strong>Durable Construction:</strong> Built with high-quality materials designed to withstand the rigors of daily professional use on demanding job sites.</li></ul><h3>Set Includes:</h3><ul><li>Automatic Taper</li><li>Flat Boxes (Multiple Sizes)</li><li>Corner Finisher & Corner Roller</li><li>Loading Pump with Filler Neck</li><li>Extendable Handles</li><li>Premium Bonus Tool Cases</li><li>Professional Hand Tool Selection</li></ul></p>",4247.0,taxable,1,,0,0,50.0,,,,Drywall Finishing Tools > Level 5 > Automatic Taping Tools,"4-600, 4-600P, Automatic Taping Tools, Bonus, Level 5, level 5 set, level5, set, taping tools",Level 5,,,0,,,,,,,,,,,L5T Automatic Taping Sets,"drywall bazooka set, automatic taping kit, drywall finishing system, power taping tools",2026-05-07,v2-production-normalized,Level 5 L5T Full Set 4-600P | Professional Automatic Taping,"Maximize drywall finishing speed with the Level 5 L5T Full Set 4-600P. Includes automatic taper, boxes, pump, and bonus tool cases for pro finishers.",/product/level5-l5t-full-set-bonus-cases-4-600p/,"index, follow",Level 5 L5T Full Set 4-600P,"automatic drywall tools, drywall taping set, Level 5 4-600P, professional taping kit, automatic taper set"
simple,4-601P,,level-5-l5t-full-set-extension-handles-bonus-tool-cases-4-601p,Level5 L5T Full Set with Extension Handles and Bonus Tool Cases Set 4 - 601P,1,visible,The Level5 L5T Full Set with Extension Handles and Bonus Tool Cases (4-601P) is engineered for professional drywall finishers seeking to maximize efficiency and achieve superior results. This comprehensive automatic taping tool set significantly accelerates project completion while maintaining high-quality finishes.,"<p>Level5 L5T Full Set with Extension Handles and Bonus Tool Cases Set 4 - 601P provides professional drywall finishers with a comprehensive automatic taping and finishing system designed for peak efficiency and superior results. This complete kit enables a significant upgrade from manual methods, allowing for faster project completion and consistent, high-quality finishes across all jobs.</p><h3>Features</h3><ul><li><strong>Accelerated Finishing:</strong> Transition from hand tools to automatic systems to dramatically increase drywall finishing speed without compromising quality standards.</li><li><strong>Enhanced Job Capacity:</strong> Equip your business to take on a greater volume of drywall finishing projects each month, expanding your operational reach.</li><li><strong>Competitive Bidding Advantage:</strong> Achieve faster finishing times, enabling more competitive bids on larger projects and a robust pipeline of work.</li><li><strong>Rapid Skill Integration:</strong> Experience a quick learning curve with automatic drywall finishing tools, supported by extensive video resources for seamless adoption.</li><li><strong>Comprehensive Toolset:</strong> This set includes all essential tools required to initiate automatic drywall taping and finishing operations.</li><li><strong>Bonus Hand Tools:</strong> Receive a complimentary set of premium Level5 hand tools, enhancing your finishing capabilities.</li></ul>",4646.0,taxable,1,,0,0,50.0,,,,Drywall Finishing Tools > Level 5 > Automatic Taping Tools,"4-601, 4-601P, Automatic Taping Tools, Bonus, Level 5, level 5 set, level5, set, taping tools",Level 5,,,0,,,,,,,,,,,Level 5 L5T Full Set,"automatic drywall taping tools, drywall finishing kit, professional drywall set, complete taping system",2026-05-07,v2-production-normalized,Level 5 L5T Full Taping Set w/ Extension Handles | 4-601P,Optimize drywall finishing with the Level 5 L5T Full Automatic Taping Set. Includes extension handles & bonus cases for peak professional efficiency. SKU 4-601P.,/product/level-5-l5t-full-set-extension-handles-bonus-tool-cases-4-601p/,"index, follow",Level 5 L5T Full Taping Set 4-601P,"automatic drywall tools, drywall finishing set, professional taping tools, level 5 4-601P, drywall extension handles"
simple,4-604,,level5-l5t-flat-box-combo-4-604,Level5 L5T Flat Box Combo with Bonus Tool Cases 4 - 604,1,visible,The Level5 L5T Flat Box Combo 4-604 is a professional-grade automatic taping set designed to maximize finishing speed and joint quality. This comprehensive kit includes premium tool cases for secure transport and organized job site management.,"<p>Level5 L5T Flat Box Combo with Bonus Tool Cases 4 - 604 provides a comprehensive solution for professional drywall finishers looking to transition from manual to automatic tools. This professional-grade set is engineered to streamline the feathering and finishing of flat joints, significantly reducing labor time while maintaining high-quality results. By integrating these precision tools into your workflow, you can increase job site throughput and handle larger contracts with confidence.<p>The kit is designed for a fast learning curve, making it accessible for those expanding their equipment arsenal. Each component is built to withstand the rigors of daily commercial use, ensuring long-term reliability and consistent performance on every project.</p><strong>Features:</strong><ul><li><strong>High-Efficiency Finishing:</strong> Accelerates the drywall taping process, allowing for faster job completion compared to traditional hand tools.</li><li><strong>Scalable Performance:</strong> Enables contractors to bid on larger projects and increase monthly job volume through improved workflow efficiency.</li><li><strong>Comprehensive Kit:</strong> Includes essential flat boxes and specialized tool cases for organized transport and long-term tool protection.</li><li><strong>Professional Build Quality:</strong> Constructed with premium materials to ensure durability and precision during high-volume applications.</li></ul><strong>Set Includes:</strong><ul><li>L5T Flat Boxes</li><li>Extendable Flat Box Handle</li><li>Premium Protective Tool Cases</li></ul></p>",1478.0,taxable,1,,0,0,25.0,,,,Drywall Finishing Tools > Level 5 > Automatic Taping Tools,"4-604, Automatic Taping Tools, Bonus, Level 5, level 5 set, level5, set, taping tools",Level 5,,,0,,,,,,,,,,,Level 5 L5T Flat Box Combo,"drywall box kit, automatic finisher set, joint compound applicator, flat joint tool set",2026-05-07,v2-production-normalized,Level 5 L5T Flat Box Combo 4-604 | Professional Taping Set,Level 5 L5T Flat Box Combo 4-604 includes premium flat boxes and tool cases. Maximize drywall finishing speed and efficiency on every job site.,/product/level5-l5t-flat-box-combo-4-604/,"index, follow",Level 5 L5T Flat Box Combo,"drywall flat box set, automatic taping tools, Level 5 4-604, drywall finishing kit, professional taping tools"
simple,4-605,,level5-l5t-flat-box-combo-extension-handle-4-605,Level5 L5T Flat Box Combo with Extension Handle and Bonus Tool Cases 4 - 605,1,visible,The Level5 L5T Flat Box Combo with Extension Handle and Bonus Tool Cases 4 - 605 is a professional-grade kit designed to maximize drywall finishing speed and precision. This comprehensive set includes high-capacity flat boxes and an adjustable extension handle to streamline large-scale joint finishing.,"<p>Level5 L5T Flat Box Combo with Extension Handle and Bonus Tool Cases 4 - 605 provides a comprehensive solution for professional drywall finishers looking to transition from manual to automatic tools. This professional-grade kit streamlines the process of finishing and feathering flat joints, significantly reducing labor time while maintaining a high-quality finish. By integrating automatic finishing technology, contractors can increase their output and manage larger project volumes with greater precision.<h3>Professional Finishing Performance</h3>The L5T series is engineered for durability and consistent mud application across various joint widths. The included extension handle offers superior reach and control, allowing for ergonomic operation on walls and ceilings without the need for constant scaffolding adjustments.<strong>Features:</strong><ul><li><strong>Enhanced Productivity:</strong> Transitioning to automatic tools allows for significantly faster completion of flat joints compared to traditional hand finishing methods.</li><li><strong>Scalable Workflow:</strong> High-speed finishing capabilities enable contractors to bid on larger projects and manage a higher volume of work with consistent results.</li><li><strong>Professional Grade Construction:</strong> Built for daily use on demanding jobsites, ensuring long-term reliability and precision in mud application.</li><li><strong>Integrated Storage Solution:</strong> Includes bonus tool cases to protect and organize your investment during transport and storage between jobsites.</li><li><strong>Adjustable Reach:</strong> The extension handle provides the necessary leverage and height to finish high joints comfortably and efficiently.</li></ul><strong>Set Includes:</strong><ul><li>L5T Flat Boxes</li><li>Extension Handle</li><li>Protective Tool Cases</li></ul></p>",1603.0,taxable,1,,0,0,30.0,,,,Drywall Finishing Tools > Level 5 > Automatic Taping Tools,"4-605, Automatic Taping Tools, Bonus, Level 5, level 5 set, level5, set, taping tools",Level 5,,,0,,,,,,,,,,,L5T Flat Box Series,"drywall finishing set, automatic taping kit, flat joint finisher, mud box combo",2026-05-07,v2-production-normalized,Level 5 L5T Flat Box Combo | Extension Handle & Cases,Professional Level 5 L5T Flat Box Combo with extension handle and cases. Optimize your drywall finishing speed and precision with SKU 4-605.,/product/level5-l5t-flat-box-combo-extension-handle-4-605/,"index, follow",Level 5 L5T Flat Box Combo,"automatic drywall tools, flat box set, drywall finishing kit, Level 5 4-605, extension handle flat box"
simple,4-707,,level5-corner-roller-storage-case-4-707,Level5 Corner Roller with Bonus Storage Case,1,visible,"The Level5 Corner Roller provides rapid, professional-grade tape embedding and air pocket removal for perfectly crisp 90-degree drywall corners. Its billet aluminum construction and floating wheel assembly ensure smooth, skip-free operation on every commercial job site.","<p>Level5 Corner Roller with Bonus Storage Case is a high-performance drywall tool engineered to bed tape into internal corners with professional precision. This second-generation tool efficiently removes air pockets and excess joint compound, ensuring a crisp 90-degree angle across every seam.</p><p>Constructed from precision-machined billet aluminum, the body is hard-coat anodized for maximum corrosion resistance and simplified cleaning after heavy use. The innovative floating wheel assembly adapts to imperfect internal seams, maintaining a perfect angle while the Kevlar-reinforced nylon bearings and Teflon washers provide ultra-smooth operation with minimal tape drag.</p><h3>Features:</h3><ul><li><strong>Precision Engineering:</strong> Four-piece billet aluminum body with hard-coat anodized side plates for commercial-grade durability.</li><li><strong>Floating Wheel Assembly:</strong> Ensures a consistent 90-degree finish even when working over irregular or imperfect internal seams.</li><li><strong>Smooth Operation:</strong> Stainless steel rollers utilize Kevlar-reinforced bearings and Teflon washers to eliminate skipping and reduce friction.</li><li><strong>Efficient Finishing:</strong> Rapidly embeds tape and flattens flanges, significantly reducing the time required compared to manual hand tools.</li><li><strong>Integrated Attachment:</strong> Heavy-duty stainless steel mount compatible with fixed or extendable handles via the required 4-877 adapter.</li><li><strong>Bonus Storage Case:</strong> Includes a dedicated protective case to maintain tool integrity during transport and storage.</li></ul>",168.0,taxable,1,,0,0,5.0,,,,Drywall Finishing Tools > Level 5 > Automatic Taping Tools,"4-707, Automatic Taping Tools, Level 5, corner roller, level 5, level5",Level 5,,,0,,,,,,,,,,,Level 5 Automatic Taping Tools,"internal corner roller, tape bedder, drywall angle roller, seam roller",2026-05-07,v2-production-normalized,Level 5 Corner Roller with Case | Professional Drywall Tool,"Bed drywall tape with precision using the Level 5 Corner Roller. Features billet aluminum body, floating wheels, and bonus storage case. SKU: 4-707.",/products/level5-corner-roller-storage-case-4-707/,"index, follow",Level 5 Corner Roller,"drywall corner roller, tape embedding tool, automatic taping tools, Level 5 4-707, internal corner finisher"
simple,4-714,,level5-gooseneck-4-714,Level5 Gooseneck,1,visible,The Level5 Gooseneck is a durable stainless steel attachment designed for rapid automatic taper filling. Its quick-change mounting bracket allows for efficient transitions between tools to maximize job site productivity.,"<p>Level5 Gooseneck is a precision-engineered component designed for the efficient filling of automatic tapers. Constructed from high-grade extruded stainless steel, this tool provides the durability and corrosion resistance required for high-volume drywall finishing environments. The integrated mounting bracket is specifically designed to facilitate rapid transitions between the gooseneck and other filler attachments, ensuring minimal downtime during the taping process. This gooseneck serves as a critical link in the compound delivery system, maintaining a secure and leak-free connection to the pump. Its streamlined design and robust material composition make it a standard choice for professional finishers seeking reliable performance on the job site. <h3>Features:</h3><ul><li><strong>Stainless Steel Construction:</strong> Extruded from premium stainless steel for maximum longevity and resistance to wear. </li><li><strong>Quick-Change Bracket:</strong> Engineered for fast, tool-free switching between the gooseneck and filler attachments. </li><li><strong>Optimized Flow:</strong> Designed to provide a smooth, consistent path for joint compound into the automatic taper. </li><li><strong>Professional Compatibility:</strong> Fits standard Level 5 compound pumps and automatic tapers for seamless integration. </li></ul></p>",112.0,taxable,1,,0,0,5.0,,,,Drywall Finishing Tools > Level 5 > Automatic Taping Tools,"4-714, Automatic Taping Tools, Level 5, goose neck, gooseneck",Level 5,,,0,,,,,,,,,,,Level 5 Automatic Taping Tools,"taper filler neck, compound pump gooseneck, drywall pump attachment",2026-05-07,v2-production-normalized,Level 5 Gooseneck | Stainless Steel Taper Filler 4-714,Level 5 Gooseneck (4-714) for automatic tapers. High-grade stainless steel construction with a quick-change bracket for efficient drywall finishing.,/product/level5-gooseneck-4-714/,"index, follow",Level 5 Gooseneck,"automatic taper filler, drywall gooseneck, Level 5 4-714, stainless steel gooseneck"
simple,4-715,,level-5-filler-4-715,Level5 Filler,1,visible,The Level5 Filler features a high-strength cast aluminum body and stainless steel nozzle for efficient compound loading. Its quick-change design allows for rapid transitions between gooseneck setups.,"<p>Level5 Filler is a professional-grade component engineered for seamless integration with compound pumps. Built to withstand the rigors of daily drywall finishing, this tool ensures efficient material transfer for automatic taping tools. The heavy-duty construction utilizes premium materials to prevent corrosion and ensure long-term reliability on the job site. Its streamlined design allows for rapid transitions between filling tasks, maximizing productivity during the finishing process.</p><p><strong>Features:</strong></p><ul><li><strong>High-Strength Construction:</strong> Manufactured from cast aluminum for a lightweight yet durable body that resists wear.</li><li><strong>Stainless Steel Nozzle:</strong> Features an extruded stainless steel filler nozzle for precise compound delivery and easy cleaning.</li><li><strong>Quick-Change Compatibility:</strong> Designed for fast swaps with goosenecks, allowing finishers to switch setups without downtime.</li><li><strong>Professional Reliability:</strong> Engineered to meet the demands of high-volume drywall contractors and professional tapers.</li></ul>",75.0,taxable,1,,0,0,2.0,,,,Drywall Finishing Tools > Level 5 > Automatic Taping Tools,"4-715, Automatic Taping Tools, Level 5, box filler, filler",Level 5,,,0,,,,,,,,,,,Level 5 Filler,"box filler, pump nozzle, compound filler, loading nozzle, drywall pump adapter",2026-05-07,v2-production-normalized,Level 5 Filler 4-715 | Aluminum Compound Pump Nozzle,"Level 5 Filler 4-715 features cast aluminum construction and a stainless steel nozzle for fast, reliable compound loading. Shop professional drywall tools.",/product/level-5-filler-4-715/,"index, follow",Level 5 Filler 4-715,"drywall box filler, compound pump nozzle, automatic taping tools, Level 5 tools, drywall finishing equipment"
