Type,SKU,Parent SKU,Slug,Name,Published,Visibility in catalog,Short description,Description,Regular price,Tax status,In stock?,Stock,Backorders allowed?,Sold individually?,Weight (lbs),Length (in),Width (in),Height (in),Categories,Tags,Brands,Images,Parent,Position,Attribute 1 name,Attribute 1 value(s),Attribute 1 visible,Attribute 1 global,Attribute 1 used for variations,Attribute 2 name,Attribute 2 value(s),Attribute 2 visible,Attribute 2 global,Attribute 2 used for variations,meta:search_keywords,meta:seo_title,meta:seo_description,meta:seo_canonical,meta:seo_robots,meta:seo_focus_keyword,meta:seo_secondary_keywords,meta:schema_brand,meta:schema_mpn,meta:schema_condition
simple,7132,,level5-plunger-cup-7132,Level5 Plunger Cup,1,visible,The Level5 Plunger Cup is a high-performance replacement part designed to maintain optimal suction and pressure in 4-760 automatic tapers. This durable component ensures consistent mud delivery and professional-grade finishing results.,"<p>Level5 Plunger Cup is a precision-engineered replacement component designed specifically for Level 5 automatic tapers. This essential part ensures your taping tools maintain optimal suction and pressure for consistent mud application on every joint. <p>Constructed from high-grade materials, this plunger cup provides a reliable seal within the taper tube, preventing leaks and maintaining the mechanical efficiency required for high-volume drywall finishing. It is a direct replacement part for the 4-760 model, ensuring a perfect fit and minimal downtime during maintenance.</p><h3>Features:</h3><ul><li><strong>Precision Fit:</strong> Specifically designed for seamless integration with Level 5 4-760 automatic tapers.</li><li><strong>Durable Construction:</strong> Built to withstand the abrasive nature of joint compound and heavy daily use.</li><li><strong>Optimized Performance:</strong> Maintains the necessary internal pressure for smooth, consistent tape and mud delivery.</li></ul></p>",39.14,taxable,1,,0,0,,,,,Drywall Finishing Tools > Level 5 > Parts,"Level 5, Level 5 Automatic Taper Parts, Parts",Level 5,,,0,,,,,,,,,,,Level 5 Plunger Cup,"taper seal, piston cup, pressure cup, rubber plunger",2026-05-07,v2-production-normalized,Level 5 Plunger Cup 7132 | Automatic Taper Part,Genuine Level 5 Plunger Cup (7132) for 4-760 automatic tapers. Maintain peak performance and consistent pressure with this durable replacement part.,/product/level5-plunger-cup-7132/,"index, follow",Level 5 Plunger Cup 7132,"automatic taper plunger, drywall taper parts, 4-760 replacement cup, Level 5 7132"
simple,7133,,level5-plunger-cup-washer-7133,Level5 Plunger Cup Washer,1,visible,The Level5 Plunger Cup Washer is a high-quality replacement seal designed to restore suction and performance in 4-760 automatic tapers.,"<p>Level5 Plunger Cup Washer is a precision-engineered replacement component designed to maintain the vacuum seal and suction efficiency of your automatic taper. This essential wear part ensures consistent compound flow and prevents leaks during high-volume drywall finishing tasks. Built to withstand the rigors of professional job sites, this washer provides a reliable fit for the internal plunger assembly. Regular replacement of this component is critical for preventing downtime and ensuring the smooth operation of your taping tools.</p><p><strong>Features:</strong></p><ul><li><strong>Precision Fit:</strong> Specifically engineered for seamless integration with the Level 5 4-760 automatic taper.</li><li><strong>Durable Construction:</strong> Manufactured from high-quality materials to resist wear from abrasive drywall compounds.</li><li><strong>Optimized Suction:</strong> Restores the airtight seal necessary for efficient compound loading and application.</li><li><strong>Easy Installation:</strong> Designed for quick field replacement to minimize tool downtime.</li></ul>",7.25,taxable,1,,0,0,,,,,Drywall Finishing Tools > Level 5 > Parts,"Level 5, Level 5 Automatic Taper Parts, Parts",Level 5,,,0,,,,,,,,,,,Automatic Taper Parts,"plunger seal, cup seal, rubber washer, taper gasket",2026-05-07,v2-production-normalized,Level 5 Plunger Cup Washer 7133 | Taper Replacement Part,Genuine Level 5 7133 Plunger Cup Washer for 4-760 automatic tapers. Restore suction and prevent leaks with this durable drywall tool replacement part.,/product/level5-plunger-cup-washer-7133/,"index, follow",Level 5 Plunger Cup Washer,"7133, automatic taper parts, drywall tool repair, taper plunger seal, Level 5 4-760 parts"
simple,7134,,level5-7134-1-4-20-x-3-4-hh-screw,Level5 1/4 - 20 X 3/4in HH Screw,1,visible,A professional-grade 1/4-20 x 3/4-inch hex head replacement screw designed for Level 5 automatic tapers. Ensure your drywall finishing tools remain in peak operating condition.,"<p>Level5 1/4 - 20 X 3/4in HH Screw is a precision-engineered replacement fastener designed specifically for Level 5 automatic drywall tapers. This high-grade hex head screw ensures a secure fit and reliable performance during intensive finishing tasks. Built to meet original equipment manufacturer standards, it provides the durability required for professional drywall environments. It serves as a direct replacement part to maintain the structural integrity of your taping tools.</p><p><strong>Features:</strong></p><ul><li><strong>Precision Threading:</strong> Features a 1/4-20 thread pitch for a perfect fit with compatible Level 5 components.</li><li><strong>Hex Head Design:</strong> Provides a secure grip for tools, preventing stripping during installation or maintenance.</li><li><strong>Durable Construction:</strong> Manufactured from high-strength materials to withstand the rigors of daily drywall finishing.</li><li><strong>Direct Compatibility:</strong> Specifically engineered for use with the Level 5 4-760 automatic taper.</li></ul>",4.0,taxable,1,,0,0,,,,,Drywall Finishing Tools > Level 5 > Parts,"Level 5, Level 5 Automatic Taper Parts, Parts",Level 5,,,0,,,,,,,,,,,Level 5 Automatic Taper Parts,"hex bolt, machine screw, fastener, replacement bolt",2026-05-07,v2-production-normalized,"Level 5 1/4-20 x 3/4"" HH Screw | SKU 7134 Taper Part","Genuine Level 5 1/4-20 x 3/4"" hex head screw (7134). Precision replacement part for the 4-760 automatic taper. Durable, high-strength drywall tool fastener.",/product/level5-7134-1-4-20-x-3-4-hh-screw/,"index, follow",Level 5 7134 HH Screw,"1/4-20 hex head screw, drywall taper parts, Level 5 4-760 replacement, automatic taper fastener"
simple,7135,,level5-1-4-20-hex-nut-7135,Level5 1/4 - 20 Hex Nut,1,visible,"The Level5 1/4 - 20 Hex Nut is a high-grade replacement fastener designed for the 4-760 Automatic Taper. It ensures a secure, professional-standard fit for critical tool maintenance.","<p>Level5 1/4 - 20 Hex Nut is a precision-engineered replacement fastener designed specifically for Level 5 automatic drywall tapers. This high-quality component ensures secure mechanical connections and maintains the structural integrity of your finishing equipment during heavy-duty use.</p><p>Engineered to meet original equipment manufacturer standards, this hex nut provides a reliable solution for tool maintenance and repair. It is an essential part for professionals who require consistent performance and longevity from their automatic taping tools.</p><h3>Features:</h3><ul><li><strong>Precision Threading:</strong> Features a standard 1/4-20 thread pitch for a perfect fit and reliable grip on compatible bolts.</li><li><strong>Durable Construction:</strong> Manufactured from high-grade materials to withstand the rigors of professional drywall finishing environments.</li><li><strong>OEM Compatibility:</strong> Specifically designed for seamless integration with the Level 5 4-760 Automatic Taper and related assemblies.</li></ul>",3.0,taxable,1,,0,0,,,,,Drywall Finishing Tools > Level 5 > Parts,"Level 5, Level 5 Automatic Taper Parts, Parts",Level 5,,,0,,,,,,,,,,,Level 5 Automatic Taper Parts,"fastener, hex fastener, machine nut, replacement nut",2026-05-07,v2-production-normalized,Level 5 1/4-20 Hex Nut | Taper Replacement Part 7135,Genuine Level 5 1/4-20 Hex Nut (SKU 7135). Precision replacement part for the 4-760 Automatic Taper. Ensure secure tool assembly and performance.,/product/level5-1-4-20-hex-nut-7135/,"index, follow",Level 5 1/4-20 Hex Nut,"7135 hex nut, automatic taper parts, drywall tool fasteners, Level 5 4-760 parts"
simple,7136,,level5-7136-4-40-6-3mm-flh-screw-phillips,"Level5 4 - 40 x 6.3MM FLH Screw, Phillips",1,visible,"This precision 4-40 x 6.3mm flat-head Phillips screw is a genuine replacement part for the Level 5 4-760 Automatic Taper. It provides a secure, flush-mount fit to maintain the structural integrity of your finishing tools.","<p>Level5 4 - 40 x 6.3MM FLH Screw, Phillips is a precision-engineered replacement fastener designed for high-performance drywall finishing equipment. This flat-head screw ensures a flush fit and secure mechanical bond within the assembly of the Level 5 Automatic Taper, maintaining the tool's structural integrity during heavy use.<p>Built to meet the exact specifications of professional finishing tools, this component provides a reliable solution for routine maintenance or emergency repairs. Its standardized dimensions ensure a perfect fit without the risk of stripping or improper seating.</p><h3>Features:</h3><ul><li><strong>Exact Compatibility:</strong> Specifically engineered for seamless integration with the Level 5 4-760 Automatic Taper.</li><li><strong>Flush Finish:</strong> The flat-head (FLH) design allows the fastener to sit level with the tool surface, preventing interference with mechanical operations.</li><li><strong>Durable Construction:</strong> Manufactured from high-quality materials to withstand the vibrations and moisture common in drywall finishing environments.</li><li><strong>Standard Drive:</strong> Features a Phillips head for straightforward installation and removal using standard professional hand tools.</li></ul></p>",4.49,taxable,1,,0,0,,,,,Drywall Finishing Tools > Level 5 > Parts,"Level 5, Level 5 Automatic Taper Parts, Parts",Level 5,,,0,,,,,,,,,,,Level 5 Automatic Taper Parts,"fastener, machine screw, replacement bolt, taper hardware",2026-05-07,v2-production-normalized,Level 5 7136 Phillips FLH Screw | 4-40 x 6.3mm Taper Part,"Genuine Level 5 7136 flat-head Phillips screw (4-40 x 6.3mm). Precision replacement part for the 4-760 Automatic Taper. Ensure a flush, secure fit.",/product/level5-7136-4-40-6-3mm-flh-screw-phillips/,"index, follow",Level 5 7136 Screw,"4-40 x 6.3mm screw, Phillips flat head screw, automatic taper parts, Level 5 replacement parts, drywall tool fasteners"
simple,7137,,level5-automatic-taper-cable-7137,Level5 Cable,1,visible,"The Level5 Cable is a high-strength replacement part for the 4-760 Automatic Taper, ensuring smooth and reliable tool operation.","<p>Level5 Cable is a precision-engineered replacement component designed specifically for the Level 5 Automatic Taper. It ensures smooth mechanical operation and maintains the high-performance standards required for professional drywall finishing. This essential part is critical for maintaining the drive system of your automatic taper, preventing downtime on the job site and ensuring consistent mud application.</p><p><strong>Features:</strong></p><ul><li><strong>Direct Compatibility:</strong> Engineered for a perfect fit with the Level 5 4-760 Automatic Taper.</li><li><strong>Durable Construction:</strong> Built to withstand the high-tension demands of continuous taping operations.</li><li><strong>Reliable Performance:</strong> Restores factory-spec responsiveness to your tool's internal mechanism.</li></ul>",10.79,taxable,1,,0,0,,,,,Drywall Finishing Tools > Level 5 > Parts,"Level 5, Level 5 Automatic Taper Parts, Parts",Level 5,,,0,,,,,,,,,,,Automatic Taper Parts,"drive cable, taper wire, replacement cable, internal cable",2026-05-07,v2-production-normalized,Level 5 Cable 7137 | Replacement for 4-760 Taper,Genuine Level 5 Cable (SKU 7137) for the 4-760 Automatic Taper. Durable replacement part to restore smooth drywall finishing performance. In stock now.,/product/level5-automatic-taper-cable-7137/,"index, follow",Level 5 Cable 7137,"automatic taper cable, drywall tool parts, Level 5 4-760 parts, taper replacement cable"
simple,7144,,level-5-control-extension-arm-7144,Level5 Control Extension Arm,1,visible,The Level 5 7144 Control Extension Arm is a high-quality replacement part designed to restore precise handling and control to your 4-760 Automatic Taper.,"<p>Level5 Control Extension Arm is a precision-engineered replacement component designed to maintain the operational integrity of professional automatic taping tools. This essential part ensures smooth control and responsiveness during high-volume drywall finishing tasks, allowing for consistent performance on the job site.<h3>Professional Grade Reliability</h3>Built to meet the rigorous standards of the drywall industry, this extension arm provides the durability required for daily use. It serves as a direct replacement for worn or damaged components, restoring the factory-standard feel and accuracy of your equipment.<strong>Features:</strong><ul><li><strong>OEM Compatibility:</strong> Specifically engineered for seamless integration with the Level 5 4-760 Automatic Taper.</li><li><strong>Durable Construction:</strong> Manufactured from high-quality materials to withstand the mechanical stresses of continuous taping operations.</li><li><strong>Precision Engineering:</strong> Maintains tight tolerances to ensure accurate control and minimize play in the tool mechanism.</li></ul></p>",47.24,taxable,1,,0,0,,,,,Drywall Finishing Tools > Level 5 > Parts,"Level 5, Level 5 Automatic Taper Parts, Parts",Level 5,,,0,,,,,,,,,,,Automatic Taper Parts,"control linkage, taper handle extension, actuator arm, replacement control lever",2026-05-07,v2-production-normalized,Level 5 Control Extension Arm 7144 | Taper Replacement Part,Genuine Level 5 7144 Control Extension Arm for the 4-760 Automatic Taper. Ensure precise control and durability for professional drywall finishing.,/product/level-5-control-extension-arm-7144/,"index, follow",Level 5 Control Extension Arm 7144,"automatic taper parts, drywall finishing tool parts, 4-760 taper repair, Level 5 replacement parts"
simple,7164,,level5-tape-spool-7164,Level5 Tape Spool,1,visible,"The Level5 Tape Spool is a durable replacement part for the 4-760 Automatic Taper that ensures smooth, consistent tape dispensing. This high-quality component is essential for maintaining professional tool performance and preventing job site delays.","<p>Level5 Tape Spool is a precision-engineered replacement component designed specifically for the Level 5 Automatic Taper. It ensures smooth, consistent tape dispensing during high-volume drywall finishing operations, maintaining the reliability of your professional equipment.</p><p>This essential part is built to withstand the rigors of daily job site use, preventing unnecessary downtime and ensuring your taping tool operates at peak efficiency.</p><p><strong>Features:</strong></p><ul><li><strong>Exact Compatibility:</strong> Engineered for a perfect fit with the Level 5 4-760 Automatic Taper model.</li><li><strong>Rugged Construction:</strong> Manufactured from high-quality materials to endure the demands of professional drywall finishing.</li><li><strong>Consistent Performance:</strong> Facilitates smooth tape flow to prevent snagging or uneven application during the taping process.</li><li><strong>Rapid Replacement:</strong> Designed for quick installation to keep your tools in service and your projects on schedule.</li></ul>",16.64,taxable,1,,0,0,,,,,Drywall Finishing Tools > Level 5 > Parts,"Level 5, Level 5 Automatic Taper Parts, Parts",Level 5,,,0,,,,,,,,,,,Level 5 Automatic Taper Parts,"Tape Holder, Taper Reel, Replacement Spool, Drywall Tape Spindle",2026-05-07,v2-production-normalized,Level 5 Tape Spool 7164 | Automatic Taper Replacement Part,Genuine Level 5 Tape Spool (7164) for the 4-760 Automatic Taper. Ensure smooth drywall tape dispensing and professional results. In stock and ready to ship.,/product/level5-tape-spool-7164/,"index, follow",Level 5 Tape Spool 7164,"Automatic Taper Parts, Drywall Taping Tool Spool, Level 5 4-760 Parts, Drywall Finishing Accessories"
simple,7165,,level-5-creaser-trigger-7165,Level5 Creaser Trigger,1,visible,"The Level5 Creaser Trigger is a genuine replacement part designed for the 4-760 automatic taper, ensuring precise creaser wheel engagement and smooth mechanical operation.","<p>Level5 Creaser Trigger is a precision-engineered replacement component designed specifically for the Level 5 automatic taper system. This trigger ensures smooth operation and reliable engagement of the creaser wheel during the taping process, maintaining the high performance expected from professional drywall finishing equipment. Built to withstand the rigors of daily job site use, this authentic Level 5 part provides a perfect fit and seamless integration with your existing tools. It is an essential component for contractors who require consistent results and minimal downtime during high-volume drywall projects. <h3>Features:</h3><ul><li><strong>Precision Fit:</strong> Engineered specifically for compatibility with the 4-760 automatic taper model.</li><li><strong>Durable Construction:</strong> Manufactured from high-quality materials to resist wear and tear in demanding environments.</li><li><strong>Smooth Operation:</strong> Restores the responsive feel and mechanical accuracy of the creaser wheel engagement.</li><li><strong>OEM Reliability:</strong> Genuine Level 5 replacement part ensures long-term performance and tool longevity.</li></ul></p>",57.14,taxable,1,,0,0,,,,,Drywall Finishing Tools > Level 5 > Parts,"Level 5, Level 5 Automatic Taper Parts, Parts",Level 5,,,0,,,,,,,,,,,Level 5 Automatic Taper Parts,"Taper trigger, creaser wheel lever, drywall taper part, replacement trigger, taper actuator",2026-05-07,v2-production-normalized,Level 5 Creaser Trigger 7165 | Taper Replacement Part,Genuine Level 5 Creaser Trigger (SKU 7165) for the 4-760 automatic taper. Restore smooth mechanical operation with this durable OEM replacement part.,/product/level-5-creaser-trigger-7165/,"index, follow",Level 5 Creaser Trigger,"4-760 taper part, automatic taper trigger, drywall tool repair, Level 5 7165, creaser wheel trigger"
simple,7166,,level5-taper-tube-7166,Level5 Taper Tube,1,visible,The Level5 Taper Tube is a high-quality replacement part engineered for seamless compatibility with the 4-760 automatic taper. It ensures consistent performance and durability for professional drywall finishing tasks.,"<p>Level5 Taper Tube is a precision-engineered replacement component designed for the Level 5 automatic taper system. It provides the structural integrity and smooth interior surface required for consistent compound flow and reliable tool performance. <p>This essential part ensures your finishing equipment maintains peak efficiency during high-volume drywall applications, reducing downtime and maintaining professional standards on the job site.</p><h3>Features:</h3><ul><li><strong>High-Grade Construction:</strong> Built from durable materials to withstand the rigors of daily drywall finishing and heavy use.</li><li><strong>Seamless Compatibility:</strong> Specifically engineered to fit Level 5 automatic taper model 4-760 for a perfect fit.</li><li><strong>Optimized Flow:</strong> Features a smooth internal bore to prevent compound buildup and ensure even distribution during application.</li><li><strong>Professional Durability:</strong> Designed to meet the demands of trade professionals who require reliable tool maintenance.</li></ul></p>",350.99,taxable,1,,0,0,,,,,Drywall Finishing Tools > Level 5 > Parts,"Level 5, Level 5 Automatic Taper Parts, Parts",Level 5,,,0,,,,,,,,,,,Level 5 Taper Tube,"main tube, taper body, replacement cylinder, automatic taper housing",2026-05-07,v2-production-normalized,Level 5 Taper Tube | Replacement Part for 4-760 Taper,Genuine Level 5 Taper Tube (SKU 7166). Precision replacement part for the 4-760 automatic taper. Durable construction for professional drywall finishing.,/product/level5-taper-tube-7166/,"index, follow",Level 5 Taper Tube 7166,"automatic taper parts, drywall taper tube, Level 5 4-760 parts, drywall finishing tool repair"
simple,7168,,level5-s-hook-7168,Level5 S - Hook,1,visible,The Level5 S-Hook is a high-quality replacement part engineered for the 4-760 Automatic Taper. It ensures reliable mechanical performance and long-term durability for professional drywall finishers.,"<p>Level5 S - Hook is a precision-engineered replacement component designed specifically for the Level 5 Automatic Taper. This essential hardware piece ensures the internal mechanism operates with the tension and reliability required for high-volume drywall finishing. Built to the exact specifications of the original equipment, this S-hook maintains the structural integrity of your taping tool. It provides a secure connection point within the assembly, preventing downtime during critical phases of a project.</p><p><strong>Features:</strong></p><ul><li><strong>OEM Compatibility:</strong> Designed specifically for use with the Level 5 4-760 Automatic Taper.</li><li><strong>Durable Construction:</strong> Manufactured from high-grade materials to withstand the rigors of daily professional use.</li><li><strong>Precision Fit:</strong> Ensures seamless integration with existing internal components for smooth tool operation.</li></ul>",3.14,taxable,1,,0,0,,,,,Drywall Finishing Tools > Level 5 > Parts,"Level 5, Level 5 Automatic Taper Parts, Parts",Level 5,,,0,,,,,,,,,,,Automatic Taper Parts,"Tension Hook, Taper Connector, Replacement S-Hook",2026-05-07,v2-production-normalized,Level 5 S-Hook 7168 | Automatic Taper Replacement Part,Genuine Level 5 S-Hook (SKU 7168) for the 4-760 Automatic Taper. Ensure reliable drywall tool performance with this precision-engineered replacement part.,/product/level5-s-hook-7168/,"index, follow",Level 5 S-Hook,"Automatic Taper Parts, Drywall Tool Repair, 4-760 Taper Hook, Level 5 7168"
simple,7169,,level5-tube-protector-7169,Level5 Tube Protector,1,visible,The Level5 Tube Protector provides essential shielding for your automatic taper's main tube to prevent job site damage. This high-quality replacement part ensures your finishing tools remain in peak operating condition.,"<p>Level5 Tube Protector is a precision-engineered replacement component designed to safeguard the main tube of your automatic taper. This durable shield prevents external damage and wear during intensive drywall finishing operations, ensuring the longevity of your primary tool.</p><p>Built to withstand the rigors of professional job sites, this protector acts as a critical barrier against dents and scratches that can compromise the smooth operation of the taper mechanism.</p><h3>Features:</h3><ul><li><strong>Precision Fit:</strong> Specifically engineered for seamless compatibility with Level 5 automatic taper model 4-760.</li><li><strong>Durable Construction:</strong> Manufactured from high-grade materials to resist impact and abrasion in demanding environments.</li><li><strong>Protective Barrier:</strong> Shields the main tube from debris and physical damage that occurs during transport and use.</li><li><strong>Easy Installation:</strong> Designed for quick replacement to minimize downtime and maintain peak productivity on the job.</li></ul>",23.39,taxable,1,,0,0,,,,,Drywall Finishing Tools > Level 5 > Parts,"Level 5, Level 5 Automatic Taper Parts, Parts",Level 5,,,0,,,,,,,,,,,Automatic Taper Parts,"tube guard, taper shield, protective sleeve, replacement casing",2026-05-07,v2-production-normalized,Level 5 Tube Protector | Taper Guard Part 7169,Protect your Level 5 automatic taper with the 7169 Tube Protector. Durable replacement part designed for model 4-760 to prevent tube damage and wear.,/product/level5-tube-protector-7169/,"index, follow",Level 5 Tube Protector 7169,"automatic taper parts, drywall tool maintenance, taper tube guard, Level 5 4-760 parts"
